,pmid,author,year,title,journal,citedByNof1000
4188,3936058,Zito,1986,Disruption of cocaine and heroin self-administration following kainic acid lesions of the nucleus accumbens.,"Pharmacology, biochemistry, and behavior",2.0
3450,17098214,Dayas,2007,Distinct patterns of neural activation associated with ethanol seeking: effects of naltrexone.,Biological psychiatry,2.0
4681,8013548,Gold,1994,"Prolonged tolerance, dependence and abstinence following subcutaneous morphine pellet implantation in the rat.",European journal of pharmacology,2.0
4682,2558677,Kelsey,1990,Lesions of the nucleus accumbens in rats reduce opiate reward but do not alter context-specific opiate tolerance.,Behavioral neuroscience,2.0
4189,282297,Koob,1979,"Effects of 6-hydroxydopamine lesions of the nucleus accumbens septi and olfactory tubercle on feeding, locomotor activity, and amphetamine anorexia in the rat.",Journal of comparative and physiological psychology,2.0
4683,20350291,Newton,2010,The substrates and binding partners of protein kinase Cepsilon.,The Biochemical journal,2.0
3451,16148237,Petrovich,2006,Amygdalar and prefrontal pathways to the lateral hypothalamus are activated by a learned cue that stimulates eating.,The Journal of neuroscience : the official journal of the Society for Neuroscience,2.0
3424,11283309,Miller,2001,An integrative theory of prefrontal cortex function.,Annual review of neuroscience,2.0
4370,8289929,Childress,1994,Cue reactivity and cue reactivity interventions in drug dependence.,NIDA research monograph,2.0
4675,16613552,Sokoloff,2006,The dopamine D3 receptor: a therapeutic target for the treatment of neuropsychiatric disorders.,CNS & neurological disorders drug targets,2.0
3468,26247973,Albrechet-Souza,2016,Corticotropin Releasing Factor Binding Protein and CRF2 Receptors in the Ventral Tegmental Area: Modulation of Ethanol Binge Drinking in C57BL/6J Mice.,"Alcoholism, clinical and experimental research",2.0
3411,10894543,Howard,2000,Identification of receptors for neuromedin U and its role in feeding.,Nature,2.0
3469,21402143,Crews,2011,Induction of innate immune genes in brain create the neurobiology of addiction.,"Brain, behavior, and immunity",2.0
4201,8450978,McCullough,1993,A neurochemical and behavioral investigation of the involvement of nucleus accumbens dopamine in instrumental avoidance.,Neuroscience,2.0
4202,25480548,Shen,2015,rMATS: robust and flexible detection of differential alternative splicing from replicate RNA-Seq data.,Proceedings of the National Academy of Sciences of the United States of America,2.0
3470,21352907,Pascual,2011,Impact of TLR4 on behavioral and cognitive dysfunctions associated with alcohol-induced neuroinflammatory damage.,"Brain, behavior, and immunity",2.0
4690,24238362,Baik,2014,Dopamine signaling in food addiction: role of dopamine D2 receptors.,BMB reports,2.0
3410,15169928,Brighton,2004,"Neuromedin U and its receptors: structure, function, and physiological roles.",Pharmacological reviews,2.0
3409,15205870,Gartlon,2005,Localisation of NMU1R and NMU2R in human and rat central nervous system and effects of neuromedin-U following central administration in rats.,Psychopharmacology,2.0
3408,15856062,Volkow,2005,How can drug addiction help us understand obesity?,Nature neuroscience,2.0
4691,21420985,Daws,2012,Insulin signaling and addiction.,Neuropharmacology,2.0
3472,19348734,Chen,2009,Minocycline affects cocaine sensitization in mice.,Neuroscience letters,2.0
3473,7714791,George,1995,Low endogenous dopamine function in brain predisposes to high alcohol preference and consumption: reversal by increasing synaptic dopamine.,The Journal of pharmacology and experimental therapeutics,2.0
3405,21549136,Corwin,2011,Feeding and reward: perspectives from three rat models of binge eating.,Physiology & behavior,2.0
3404,22958744,Dichter,2012,Reward circuitry dysfunction in psychiatric and neurodevelopmental disorders and genetic syndromes: animal models and clinical findings.,Journal of neurodevelopmental disorders,2.0
4692,16775146,Volkow,2006,Cocaine cues and dopamine in dorsal striatum: mechanism of craving in cocaine addiction.,The Journal of neuroscience : the official journal of the Society for Neuroscience,2.0
4358,11691979,Greengard,2001,The neurobiology of slow synaptic transmission.,"Science (New York, N.Y.)",2.0
4693,2991484,Hollingsworth,1985,"Biochemical characterization of a filtered synaptoneurosome preparation from guinea pig cerebral cortex: cyclic adenosine 3':5'-monophosphate-generating systems, receptors, and enzymes.",The Journal of neuroscience : the official journal of the Society for Neuroscience,2.0
4694,21769724,Anker,2011,Females are more vulnerable to drug abuse than males: evidence from preclinical studies and the role of ovarian hormones.,Current topics in behavioral neurosciences,2.0
3401,11567079,Chou,2001,Orexin (hypocretin) neurons contain dynorphin.,The Journal of neuroscience : the official journal of the Society for Neuroscience,2.0
4200,9704982,Balleine,1999,Goal-directed instrumental action: contingency and incentive learning and their cortical substrates.,Neuropharmacology,2.0
3412,10887190,Hosoya,2000,Identification and functional characterization of a novel subtype of neuromedin U receptor.,The Journal of biological chemistry,2.0
3423,11726774,Knutson,2002,Dissociation of reward anticipation and outcome with event-related fMRI.,Neuroreport,2.0
4199,15548642,Maurice,2005,D2 dopamine receptor-mediated modulation of voltage-dependent Na+ channels reduces autonomous activity in striatal cholinergic interneurons.,The Journal of neuroscience : the official journal of the Society for Neuroscience,2.0
3422,17329432,Seeley,2007,Dissociable intrinsic connectivity networks for salience processing and executive control.,The Journal of neuroscience : the official journal of the Society for Neuroscience,2.0
4360,21615721,Kehr,2012,"Mephedrone, compared with MDMA (ecstasy) and amphetamine, rapidly increases both dopamine and 5-HT levels in nucleus accumbens of awake rats.",British journal of pharmacology,2.0
3421,19328237,Hahn,2009,Neural response to reward anticipation is modulated by Gray's impulsivity.,NeuroImage,2.0
4359,22952999,Wright,2013,Effect of ambient temperature on the thermoregulatory and locomotor stimulant effects of 4-methylmethcathinone in Wistar and Sprague-Dawley rats.,PloS one,2.0
4687,17145509,Liu,2007,Modulation of D2R-NR2B interactions in response to cocaine.,Neuron,2.0
3420,20845394,Hahn,2012,Association between reward-related activation in the ventral striatum and trait reward sensitivity is moderated by dopamine transporter genotype.,Human brain mapping,2.0
3461,24125784,Clissold,2014,"Serotonin 1A, 1B, and 7 receptors of the rat medial nucleus accumbens differentially regulate feeding, water intake, and locomotor activity.","Pharmacology, biochemistry, and behavior",2.0
3462,20682192,Rodd,2010,Serotonin-3 receptors in the posterior ventral tegmental area regulate ethanol self-administration of alcohol-preferring (P) rats.,"Alcohol (Fayetteville, N.Y.)",2.0
3463,19128203,Engleman,2009,The role of 5-HT3 receptors in drug abuse and as a target for pharmacotherapy.,CNS & neurological disorders drug targets,2.0
3417,17140644,Peris,2007,Brain ethanol levels in rats after voluntary ethanol consumption using a sweetened gelatin vehicle.,"Pharmacology, biochemistry, and behavior",2.0
4197,23142759,Nieh,2013,Optogenetic dissection of neural circuits underlying emotional valence and motivated behaviors.,Brain research,2.0
3464,16854442,Will,2006,Pharmacological characterization of high-fat feeding induced by opioid stimulation of the ventral striatum.,Physiology & behavior,2.0
3465,16793030,Hayes,2006,Dorsal hindbrain 5-HT3 receptors participate in control of meal size and mediate CCK-induced satiation.,Brain research,2.0
4198,20096336,Farrar,2010,Nucleus accumbens and effort-related functions: behavioral and neural markers of the interactions between adenosine A2A and dopamine D2 receptors.,Neuroscience,2.0
3466,2767122,Carboni,1989,Differential inhibitory effects of a 5-HT3 antagonist on drug-induced stimulation of dopamine release.,European journal of pharmacology,2.0
4688,15521361,Neve,2005,Dopamine receptor signaling.,Journal of receptor and signal transduction research,2.0
3467,2272364,Wozniak,1991,Antagonism of 5-HT3 receptors attenuates the effects of ethanol on extracellular dopamine.,European journal of pharmacology,2.0
4689,24988947,Siciliano,2014,Amphetamine potency varies with dopamine uptake rate across striatal subregions.,Journal of neurochemistry,2.0
3414,25805996,Weiland,2015,Ceftriaxone and cefazolin attenuate the cue-primed reinstatement of alcohol-seeking.,Frontiers in pharmacology,2.0
4684,19225761,Gass,2009,Role of protein kinase C epsilon (PKCvarepsilon) in the reduction of ethanol reinforcement due to mGluR5 antagonism in the nucleus accumbens shell.,Psychopharmacology,2.0
3843,19465068,Rajput,2009,Colocalization of dopamine receptor subtypes with dopamine and cAMP-regulated phosphoprotein (DARPP-32) in rat brain.,Neuroscience research,2.0
4701,19477151,David,2009,Neurogenesis-dependent and -independent effects of fluoxetine in an animal model of anxiety/depression.,Neuron,2.0
4753,9618003,Ikemoto,1998,Rats self-administer carbachol directly into the nucleus accumbens.,Physiology & behavior,2.0
4301,14627643,Zhang,2003,Glutamate spillover in the striatum depresses dopaminergic transmission by activating group I metabotropic glutamate receptors.,The Journal of neuroscience : the official journal of the Society for Neuroscience,2.0
3234,29582754,Caref,2019,Endogenous opioids in the nucleus accumbens promote approach to high-fat food in the absence of caloric need.,eLife,2.0
3235,28653666,Wenzel,2018,Endocannabinoid Regulation of Reward and Reinforcement through Interaction with Dopamine and Endogenous Opioid Signaling.,Neuropsychopharmacology : official publication of the American College of Neuropsychopharmacology,2.0
4302,24976947,Ghahramani,2014,The effects of perinatal testosterone exposure on the DNA methylome of the mouse brain are late-emerging.,Biology of sex differences,2.0
4754,22118158,Song,2012,In vivo neurochemical monitoring using benzoyl chloride derivatization and liquid chromatography-mass spectrometry.,Analytical chemistry,2.0
4303,24008343,Meitzen,2014,Palmitoylation of estrogen receptors is essential for neuronal membrane signaling.,Endocrinology,2.0
4752,15901784,Chefer,2006,Endogenous kappa-opioid receptor systems regulate mesoaccumbal dopamine dynamics and vulnerability to cocaine.,The Journal of neuroscience : the official journal of the Society for Neuroscience,2.0
4306,8389427,Boeijinga,1993,Responses of the nucleus accumbens following fornix/fimbria stimulation in the rat. Identification and long-term potentiation of mono- and polysynaptic pathways.,Neuroscience,2.0
4264,18639235,Tomasiewicz,2009,"The kappa-opioid agonist U69,593 blocks cocaine-induced enhancement of brain stimulation reward.",Biological psychiatry,2.0
4263,21228061,Baumann,2011,In vivo effects of amphetamine analogs reveal evidence for serotonergic inhibition of mesolimbic dopamine transmission in the rat.,The Journal of pharmacology and experimental therapeutics,2.0
4750,17360123,Hamlin,2007,The neural correlates and role of D1 dopamine receptors in renewal of extinguished alcohol-seeking.,Neuroscience,2.0
3238,26097003,Lardeux,2016,Intermittent-access binge consumption of sweet high-fat liquid does not require opioid or dopamine receptors in the nucleus accumbens.,Behavioural brain research,2.0
4749,23588036,Oberlin,2014,Beer flavor provokes striatal dopamine release in male drinkers: mediation by family history of alcoholism.,Neuropsychopharmacology : official publication of the American College of Neuropsychopharmacology,2.0
3239,25637939,Fields,2015,Understanding opioid reward.,Trends in neurosciences,2.0
3233,10195128,Rocha,1999,Cocaine self-administration in dopamine-transporter knockout mice.,Nature neuroscience,2.0
3231,20193665,Shaffer,2010,Regulation of group I metabotropic glutamate receptor expression in the rat striatum and prefrontal cortex in response to amphetamine in vivo.,Brain research,2.0
3230,20716669,Traynelis,2010,"Glutamate receptor ion channels: structure, regulation, and function.",Pharmacological reviews,2.0
4755,10911930,Koob,2000,Neurobiology of addiction. Toward the development of new therapies.,Annals of the New York Academy of Sciences,2.0
4756,24453318,FitzGerald,2014,Reward-related activity in ventral striatum is action contingent and modulated by behavioral relevance.,The Journal of neuroscience : the official journal of the Society for Neuroscience,2.0
3228,25964986,McGrath,2016,Implementing guidelines on reporting research using animals (ARRIVE etc.): new requirements for publication in BJP.,British journal of pharmacology,2.0
3227,27832448,Caffino,2017,Developmental Exposure to Cocaine Dynamically Dysregulates Cortical Arc/Arg3.1 Modulation in Response to a Challenge.,Neurotoxicity research,2.0
4300,17825262,Grady,2007,The subtypes of nicotinic acetylcholine receptors on dopaminergic terminals of mouse striatum.,Biochemical pharmacology,2.0
3226,29149325,Harding,2019,The IUPHAR/BPS Guide to PHARMACOLOGY in 2018: updates and expansion to encompass the new guide to IMMUNOPHARMACOLOGY.,Nucleic acids research,2.0
4265,11432683,Andrews,2001,Effects of cocaine on extracellular dopamine and serotonin levels in the nucleus accumbens.,Psychopharmacology,2.0
3225,29520785,Curtis,2019,Experimental design and analysis and their reporting II: updated and simplified guidance for authors and peer reviewers.,British journal of pharmacology,2.0
4266,11071707,Rothman,2001,Amphetamine-type central nervous system stimulants release norepinephrine more potently than they release dopamine and serotonin.,"Synapse (New York, N.Y.)",2.0
3224,2855239,Di Chiara,1989,Opposite effects of mu and kappa opiate agonists on dopamine release in the nucleus accumbens and in the dorsal caudate of freely moving rats.,The Journal of pharmacology and experimental therapeutics,2.0
4757,15528409,Frank,2005,By carrot or by stick: cognitive reinforcement learning in parkinsonism.,"Science (New York, N.Y.)",2.0
4267,19595731,Walker,2010,Selective participation of the bed nucleus of the stria terminalis and CRF in sustained anxiety-like versus phasic fear-like responses.,Progress in neuro-psychopharmacology & biological psychiatry,2.0
3221,11125013,Thompson,2001,Kappa-opioid receptor activation modifies dopamine uptake in the nucleus accumbens and opposes the effects of cocaine.,The Journal of neuroscience : the official journal of the Society for Neuroscience,2.0
3220,11430844,Heim,2001,The role of childhood trauma in the neurobiology of mood and anxiety disorders: preclinical and clinical studies.,Biological psychiatry,2.0
3240,24128684,Seeman,2014,Is schizophrenia a dopamine supersensitivity psychotic reaction?,Progress in neuro-psychopharmacology & biological psychiatry,2.0
4748,10890817,Tiffany,2000,Cognitive concepts of craving.,Alcohol research & health : the journal of the National Institute on Alcohol Abuse and Alcoholism,2.0
4758,12371510,Joel,2003,Actor-critic models of the basal ganglia: new anatomical and computational perspectives.,Neural networks : the official journal of the International Neural Network Society,2.0
4740,25446574,Pisanu,2015,Impairment of acquisition of intravenous cocaine self-administration  by RNA-interference of dopamine D1-receptors in the nucleus  accumbens shell.,Neuropharmacology,2.0
3257,29397901,Cates,2019,Transcription Factor E2F3a in Nucleus Accumbens Affects Cocaine Action via Transcription and Alternative Splicing.,Biological psychiatry,2.0
4743,2529365,Bergman,1989,Effects of cocaine and related drugs in nonhuman primates. III. Self-administration by squirrel monkeys.,The Journal of pharmacology and experimental therapeutics,2.0
4310,24109187,Quintero,2014,Role of nucleus accumbens glutamatergic plasticity in drug addiction.,Neuropsychiatric disease and treatment,2.0
4256,24231923,De Felice,2014,"Synthetic cathinones: chemical phylogeny, physiology, and neuropharmacology.",Life sciences,2.0
4742,8158252,Devine,1994,"Self-administration of morphine, DAMGO, and DPDPE into the ventral tegmental area of rats.",The Journal of neuroscience : the official journal of the Society for Neuroscience,2.0
4741,22196333,Mazei-Robison,2012,Role for mTOR signaling and neuronal activity in morphine-induced adaptations in ventral tegmental area dopamine neurons.,Neuron,2.0
4739,27251622,Owesson-White,2017,Cue-Evoked Dopamine Release Rapidly Modulates D2 Neurons in the Nucleus Accumbens During Motivated Behavior.,The Journal of neuroscience : the official journal of the Society for Neuroscience,2.0
4747,14981881,Nestler,2004,The addicted brain.,Scientific American,2.0
4738,7521083,Di Chiara,1994,Modulatory functions of neurotransmitters in the striatum: ACh/dopamine/NMDA interactions.,Trends in neurosciences,2.0
3264,10918599,He,2000,"Identification of E2F-3B, an alternative form of E2F-3 lacking a conserved N-terminal region.",Oncogene,2.0
4311,22340713,Girault,2012,"Signaling in striatal neurons: the phosphoproteins of reward, addiction, and dyskinesia.",Progress in molecular biology and translational science,2.0
3265,10779352,Leone,2000,Identification of a novel E2F3 product suggests a mechanism for determining specificity of repression by Rb proteins.,Molecular and cellular biology,2.0
3266,8609891,Nye,1996,Induction of chronic Fos-related antigens in rat brain by chronic morphine administration.,Molecular pharmacology,2.0
4312,21055728,Pascoli,2011,Cyclic adenosine monophosphate-independent tyrosine phosphorylation of NR2B mediates cocaine-induced extracellular signal-regulated kinase activation.,Biological psychiatry,2.0
4309,2381511,Boeijinga,1990,Paired-pulse facilitation in the nucleus accumbens following stimulation of subicular inputs in the rat.,Neuroscience,2.0
3255,8786435,Yan,1996,"Muscarinic (m2/m4) receptors reduce N- and P-type Ca2+ currents in rat neostriatal cholinergic interneurons through a fast, membrane-delimited, G-protein pathway.",The Journal of neuroscience : the official journal of the Society for Neuroscience,2.0
3254,9151296,Borg,1997,"Involvement of mu- and delta-opioid receptors in the effects of systemic and locally perfused morphine on extracellular levels of dopamine, DOPAC and HVA in the nucleus accumbens of the halothane-anaesthetized rat.",Naunyn-Schmiedeberg's archives of pharmacology,2.0
4744,26006060,Cooch,2016,Orbitofrontal lesions eliminate signalling of biological significance in cue-responsive ventral striatal neurons.,Nature communications,2.0
4258,23597511,Aarde,2014,"The novel recreational drug 3,4-methylenedioxypyrovalerone (MDPV) is a potent psychomotor stimulant: self-administration and locomotor activity in rats.",Neuropharmacology,2.0
4259,23072836,Baumann,2013,"Powerful cocaine-like actions of 3,4-methylenedioxypyrovalerone (MDPV), a principal constituent of psychoactive 'bath salts' products.",Neuropsychopharmacology : official publication of the American College of Neuropsychopharmacology,2.0
3251,12710989,Garris,2003,A role for presynaptic mechanisms in the actions of nomifensine and haloperidol.,Neuroscience,2.0
4745,1393539,Hakan,1992,Electrophysiological evidence for reciprocal connectivity between the nucleus accumbens septi and ventral pallidal region.,Brain research,2.0
4260,22897747,Simmler,2013,Pharmacological characterization of designer cathinones in vitro.,British journal of pharmacology,2.0
3249,15897718,Robinson,2005,Acute ethanol decreases dopamine transporter velocity in rat striatum: in vivo and in vitro electrochemical measurements.,"Alcoholism, clinical and experimental research",2.0
4308,4047397,Yang,1985,An electrophysiological study of the neural projections from the hippocampus to the ventral pallidum and the subpallidal areas by way of the nucleus accumbens.,Neuroscience,2.0
4307,6745361,Lopes da Silva,1984,A functional link between the limbic cortex and ventral striatum: physiology of the subiculum accumbens pathway.,Experimental brain research,2.0
3247,17068095,Férézou,2007,Extensive overlap of mu-opioid and nicotinic sensitivity in cortical interneurons.,"Cerebral cortex (New York, N.Y. : 1991)",2.0
3246,17320293,Woolley,2007,Nucleus accumbens opioid signaling conditions short-term flavor preferences.,Neuroscience,2.0
3245,18550291,Soderman,2009,Cocaine reward and hyperactivity in the rat: sites of mu opioid receptor modulation.,Neuroscience,2.0
4261,22784198,Watterson,2014,"Potent rewarding and reinforcing effects of the synthetic cathinone 3,4-methylenedioxypyrovalerone (MDPV).",Addiction biology,2.0
4746,12907793,Santarelli,2003,Requirement of hippocampal neurogenesis for the behavioral effects of antidepressants.,"Science (New York, N.Y.)",2.0
4268,12600711,Walker,2003,"Role of the bed nucleus of the stria terminalis versus the amygdala in fear, stress, and anxiety.",European journal of pharmacology,2.0
4299,22458761,Calipari,2014,Methylphenidate and cocaine self-administration produce distinct dopamine terminal alterations.,Addiction biology,2.0
4702,10360120,Kendler,1999,Causal relationship between stressful life events and the onset of major depression.,The American journal of psychiatry,2.0
3177,12373531,Baker,2004,Cystine/glutamate exchange serves as the source for extracellular glutamate: modifications by repeated cocaine administration.,Amino acids,2.0
4282,1554433,Davis,1992,Analysis of the microstructure of the rhythmic tongue movements of rats ingesting maltose and sucrose solutions.,Behavioral neuroscience,2.0
4281,3797337,Majeed,1987,Stimulation of food intake following opioid microinjection into the nucleus accumbens septi in rats.,Peptides,2.0
3174,16196030,Gabbott,2006,"Prefrontal cortex in the rat: projections to subcortical autonomic, motor, and limbic centers.",The Journal of comparative neurology,2.0
3175,16012530,Sammut,2006,Phasic dopaminergic transmission increases NO efflux in the rat dorsal striatum via a neuronal NOS and a dopamine D(1/5) receptor-dependent mechanism.,Neuropsychopharmacology : official publication of the American College of Neuropsychopharmacology,2.0
4280,3998213,Haber,1985,Efferent connections of the ventral pallidum: evidence of a dual striato pallidofugal pathway.,The Journal of comparative neurology,2.0
3176,15944123,Huang,2005,S-nitrosylation of N-ethylmaleimide sensitive factor mediates surface expression of AMPA receptors.,Neuron,2.0
4279,22430644,Plaza-Zabala,2012,The hypocretin/orexin system: implications for drug reward and relapse.,Molecular neurobiology,2.0
4289,18928402,Beaulieu,2009,Akt/GSK3 signaling in the action of psychotropic drugs.,Annual review of pharmacology and toxicology,2.0
3179,9721919,Itzhak,1998,The role of neuronal nitric oxide synthase in cocaine-induced conditioned place preference.,Neuroreport,2.0
4288,23188793,Urs,2013,Deletion of GSK3β in D2R-expressing neurons reveals distinct roles for β-arrestin signaling in antipsychotic and lithium action.,Proceedings of the National Academy of Sciences of the United States of America,2.0
3181,8581469,Saulskaya,1996,Extracellular glutamate in the nucleus accumbens during a conditioned emotional response in the rat.,Brain research,2.0
3182,7820652,Hu,1995,Direct measurement of glutamate release in the brain using a dual enzyme-based electrochemical sensor.,Brain research,2.0
3183,1827915,Le Moine,1991,Phenotypical characterization of the rat striatal neurons expressing the D1 dopamine receptor gene.,Proceedings of the National Academy of Sciences of the United States of America,2.0
3184,25908669,Mai,2016,Dopamine D1/D2 Receptor Activity in the Nucleus Accumbens Core But Not in the Nucleus Accumbens Shell and Orbitofrontal Cortex Modulates Risk-Based Decision Making.,The international journal of neuropsychopharmacology,2.0
3172,20175220,Lin,2010,Nitric oxide signaling via cGMP-stimulated phosphodiesterase in striatal neurons.,"Synapse (New York, N.Y.)",2.0
3171,21792580,Sinha,2012,New findings on biological factors predicting addiction relapse vulnerability.,Current psychiatry reports,2.0
4283,28196854,Johnson,2018,Hypothalamic transcriptomic alterations in male and female California mice (<i>Peromyscus californicus</i>) developmentally exposed to bisphenol A or ethinyl estradiol.,Physiological reports,2.0
3170,27207718,Pati,2017,Alcohol consumption increases basal extracellular glutamate in the nucleus accumbens core of Sprague-Dawley rats without increasing spontaneous glutamate release.,The European journal of neuroscience,2.0
3169,30926546,Siemsen,2019,Effects of Methamphetamine Self-Administration and Extinction on Astrocyte Structure and Function in the Nucleus Accumbens Core.,Neuroscience,2.0
3167,2969467,Lévesque,1988,Rapid conversion of high into low striatal D2-dopamine receptor agonist binding states after an acute physiological dose of 17 beta-estradiol.,Neuroscience letters,2.0
4764,19202072,Kim,2009,Methylphenidate-induced dendritic spine formation and DeltaFosB expression in nucleus accumbens.,Proceedings of the National Academy of Sciences of the United States of America,2.0
3166,6472577,Dluzen,1984,Bimodal effect of progesterone on in vitro dopamine function of the rat corpus striatum.,Neuroendocrinology,2.0
3165,8180794,Bazzett,1994,Sex differences in the rapid and acute effects of estrogen on striatal D2 dopamine receptor binding.,Brain research,2.0
3164,9661256,Xiao,1998,Effects of estrogen agonists on amphetamine-stimulated striatal dopamine release.,"Synapse (New York, N.Y.)",2.0
4286,12926012,Härtig,2003,Complementary distribution of vesicular glutamate transporters 1 and 2 in the nucleus accumbens of rat: Relationship to calretinin-containing extrinsic innervation and calbindin-immunoreactive neurons.,The Journal of comparative neurology,2.0
