,pmid,author,year,title,journal,citedByNof1000
1537,26979294,Singer,2018,Drug-Paired Contextual Stimuli Increase Dendritic Spine Dynamics in Select Nucleus Accumbens Neurons.,Neuropsychopharmacology : official publication of the American College of Neuropsychopharmacology,2.0
1503,19144741,Berke,2009,Striatal versus hippocampal representations during win-stay maze performance.,Journal of neurophysiology,2.0
1500,23473324,Kheirbek,2013,Differential control of learning and anxiety along the dorsoventral axis of the dentate gyrus.,Neuron,2.0
1497,10827444,Bush,None,Cognitive and emotional influences in anterior cingulate cortex.,Trends in cognitive sciences,2.0
1469,2504222,Cole,1989,Effects of 6-hydroxydopamine lesions of the nucleus accumbens septi on performance of a 5-choice serial reaction time task in rats: implications for theories of selective attention and arousal.,Behavioural brain research,2.0
1440,27807165,Sleezer,2017,Rule Encoding in Orbitofrontal Cortex and Striatum Guides Selection.,The Journal of neuroscience : the official journal of the Society for Neuroscience,2.0
1443,26642092,Chang,2016,Brief optogenetic inhibition of dopamine neurons mimics endogenous negative reward prediction errors.,Nature neuroscience,2.0
1444,26494275,Keiflin,2016,Dopamine Prediction Errors in Reward Learning and Addiction: From Theory to Neural Circuitry.,Neuron,2.0
1447,23790313,Burton,2014,Ventral striatum lesions enhance stimulus and response encoding in dorsal striatum.,Biological psychiatry,2.0
1450,23205006,Khamassi,2012,Integrating cortico-limbic-basal ganglia architectures for learning model-based and model-free navigation strategies.,Frontiers in behavioral neuroscience,2.0
1459,18793321,Yin,2009,Reward-guided learning beyond dopamine in the nucleus accumbens: the integrative functions of cortico-basal ganglia networks.,The European journal of neuroscience,2.0
1468,10934279,Hauber,2000,"NMDA, but not dopamine D(2), receptors in the rat nucleus accumbens areinvolved in guidance of instrumental behavior by stimuli predicting reward magnitude.",The Journal of neuroscience : the official journal of the Society for Neuroscience,2.0
1471,26748088,Leong,2016,White-Matter Tract Connecting Anterior Insula to Nucleus Accumbens Correlates with Reduced Preference for Positively Skewed Gambles.,Neuron,2.0
1496,14624855,Ji,2004,Central sensitization and LTP: do pain and memory share similar mechanisms?,Trends in neurosciences,2.0
1473,25879622,Lucas-Neto,2016,Advanced MR Imaging of the Human Nucleus Accumbens--Additional Guiding Tool for Deep Brain Stimulation.,Neuromodulation : journal of the International Neuromodulation Society,2.0
1474,25726497,Dougherty,2016,A Randomized Sham-Controlled Trial of Deep Brain Stimulation of the Ventral Capsule/Ventral Striatum for Chronic Treatment-Resistant Depression.,Biological psychiatry,2.0
1476,23702418,Sotiropoulos,2014,Advances in diffusion MRI acquisition and processing in the Human Connectome Project.,NeuroImage,2.0
1477,23702417,Uğurbil,2014,Pushing spatial and temporal resolution for functional and diffusion MRI in the Human Connectome Project.,NeuroImage,2.0
1481,17070705,Behrens,2007,Probabilistic diffusion tractography with multiple fibre orientations: What can we gain?,NeuroImage,2.0
1485,14654453,Fischl,2004,Automatically parcellating the human cerebral cortex.,"Cerebral cortex (New York, N.Y. : 1991)",2.0
1493,22642651,Whitfield-Gabrieli,2012,Conn: a functional connectivity toolbox for correlated and anticorrelated brain networks.,Brain connectivity,2.0
208,25930075,Rajkowska,2016,Oligodendrocyte morphometry and expression of myelin - Related mRNA in ventral prefrontal white matter in major depressive disorder.,Journal of psychiatric research,2.0
207,26037721,Afonso-Grunz,2015,Principles of miRNA-mRNA interactions: beyond sequence complementarity.,Cellular and molecular life sciences : CMLS,2.0
203,27452462,Bosch-Bouju,2017,Endocannabinoid-Mediated Plasticity in Nucleus Accumbens Controls Vulnerability to Anxiety after Social Defeat Stress.,Cell reports,2.0
1820,15748849,Marie,2005,Generation of silent synapses by acute in vivo expression of CaMKIV and CREB.,Neuron,2.0
1757,12904478,Mitani,2003,Functional changes of glial glutamate transporter GLT-1 during ischemia: an in vivo study in the hippocampal CA1 of normal mice and mutant mice lacking GLT-1.,The Journal of neuroscience : the official journal of the Society for Neuroscience,2.0
1758,11275404,Segovia,2001,Involvement of NMDA and AMPA/kainate receptors in the effects of endogenous glutamate on extracellular concentrations of dopamine and GABA in the nucleus accumbens of the awake rat.,Brain research bulletin,2.0
1763,24445951,Ortinski,2015,Cocaine-induced changes in NMDA receptor signaling.,Molecular neurobiology,2.0
1764,24411738,Cazorla,2014,Dopamine D2 receptors regulate the anatomical and functional balance of basal ganglia circuitry.,Neuron,2.0
1766,24182624,Peters,2014,Targeting cocaine versus heroin memories: divergent roles within ventromedial prefrontal cortex.,Trends in pharmacological sciences,2.0
1768,23719812,Ortinski,2013,Extrasynaptic targeting of NMDA receptors following D1 dopamine receptor activation and cocaine self-administration.,The Journal of neuroscience : the official journal of the Society for Neuroscience,2.0
1772,23126270,Hogarth,2013,Associative learning mechanisms underpinning the transition from recreational drug use to addiction.,Annals of the New York Academy of Sciences,2.0
1774,22621711,Liu,2013,Gentiopicroside attenuates morphine rewarding effect through downregulation of GluN2B receptors in nucleus accumbens.,CNS neuroscience & therapeutics,2.0
1780,21833504,Rothwell,2012,Protracted manifestations of acute dependence after a single morphine exposure.,Psychopharmacology,2.0
1793,19474322,Schumann,2009,Prolonged withdrawal from repeated noncontingent cocaine exposure increases NMDA receptor expression and ERK activity in the nucleus accumbens.,The Journal of neuroscience : the official journal of the Society for Neuroscience,2.0
1799,18647612,Haydon,2009,Astrocytic control of synaptic transmission and plasticity: a target for drugs of abuse?,Neuropharmacology,2.0
1800,18601982,Kau,2008,Blunted cystine-glutamate antiporter function in the nucleus accumbens promotes cocaine-induced drug seeking.,Neuroscience,2.0
1802,18094234,Madayag,2008,Repeated N-acetylcysteine administration alters plasticity-dependent effects of cocaine.,The Journal of neuroscience : the official journal of the Society for Neuroscience,2.0
1808,17321516,Murray,2007,Nucleus accumbens NMDA receptor subunit expression and function is enhanced in morphine-dependent rats.,European journal of pharmacology,2.0
1811,16794574,Zhang,2007,Reversal of cocaine-induced behavioral sensitization and associated phosphorylation of the NR2B and GluR1 subunits of the NMDA and AMPA receptors.,Neuropsychopharmacology : official publication of the American College of Neuropsychopharmacology,2.0
1814,16300631,Venton,2006,"Transient changes in nucleus accumbens amino acid concentrations correlate with individual responsivity to the predator fox odor 2,5-dihydro-2,4,5-trimethylthiazoline.",Journal of neurochemistry,2.0
1815,16190901,Miyatake,2006,Glutamatergic neurotransmission and protein kinase C play a role in neuron-glia communication during the development of methamphetamine-induced psychological dependence.,The European journal of neuroscience,2.0
1756,14622225,Brenz Verca,2003,Distribution of alpha- and gamma-synucleins in the adult rat brain and their modification by high-dose cocaine treatment.,The European journal of neuroscience,2.0
1754,15226739,Shen,2004,Regional differences in extracellular dopamine and serotonin assessed by in vivo microdialysis in mice lacking dopamine and/or serotonin transporters.,Neuropsychopharmacology : official publication of the American College of Neuropsychopharmacology,2.0
1738,24234439,Pawson,2014,The IUPHAR/BPS Guide to PHARMACOLOGY: an expert-driven knowledgebase of drug targets and their ligands.,Nucleic acids research,2.0
1722,1321430,Insel,1992,Oxytocin receptor distribution reflects social organization in monogamous and polygamous voles.,Proceedings of the National Academy of Sciences of the United States of America,2.0
1707,23370363,Barrett,2013,Variation in vasopressin receptor (Avpr1a) expression creates diversity in behaviors related to monogamy in prairie voles.,Hormones and behavior,2.0
1710,20618447,Pitchers,2011,ΔFosB in the nucleus accumbens is critical for reinforcing effects of sexual reward.,"Genes, brain, and behavior",2.0
1712,18923404,Bosch,2009,The CRF system mediates increased passive stress-coping behavior following the loss of a bonded partner in a monogamous rodent.,Neuropsychopharmacology : official publication of the American College of Neuropsychopharmacology,2.0
1717,11983317,Jeanblanc,2002,Dissociation in the involvement of dopaminergic neurons innervating the core and shell subregions of the nucleus accumbens in latent inhibition and affective perception.,Neuroscience,2.0
1718,8516669,Carter,1993,Monogamy and the prairie vole.,Scientific American,2.0
1719,7630584,Carter,1995,Physiological substrates of mammalian monogamy: the prairie vole model.,Neuroscience and biobehavioral reviews,2.0
1721,1398553,Williams,1992,Development of partner preferences in female prairie voles (Microtus ochrogaster): the role of social and sexual experience.,Hormones and behavior,2.0
1723,857268,Kleiman,1977,Monogamy in mammals.,The Quarterly review of biology,2.0
1736,24528243,Alexander,2014,The Concise Guide to PHARMACOLOGY 2013/14: enzymes.,British journal of pharmacology,2.0
1724,27093941,Camarini,2017,Behavioral sensitization to ethanol: Neural basis and factors that influence its acquisition and expression.,Brain research bulletin,2.0
1725,26408156,Pertwee,2015,Endocannabinoids and Their Pharmacological Actions.,Handbook of experimental pharmacology,2.0
1726,25347455,Fezza,2015,"Endocannabinoids, related compounds and their metabolic routes.","Molecules (Basel, Switzerland)",2.0
1728,21798285,Serrano,2012,"Endocannabinoid influence in drug reinforcement, dependence and addiction-related behaviors.",Pharmacology & therapeutics,2.0
1730,17409233,Caillé,2007,"Specific alterations of extracellular endocannabinoid levels in the nucleus accumbens by ethanol, heroin, and cocaine self-administration.",The Journal of neuroscience : the official journal of the Society for Neuroscience,2.0
1731,11804613,Frantz,2002,5-HT(6) receptor antagonism potentiates the behavioral and neurochemical effects of amphetamine but not cocaine.,Neuropharmacology,2.0
1732,11470906,Cravatt,2001,Supersensitivity to anandamide and enhanced endogenous cannabinoid signaling in mice lacking fatty acid amide hydrolase.,Proceedings of the National Academy of Sciences of the United States of America,2.0
1819,15777776,Jacobs,2005,Morphine causes a delayed increase in glutamate receptor functioning in the nucleus accumbens core.,European journal of pharmacology,2.0
1821,15466321,Self,2005,Extinction training regulates neuroadaptive responses to withdrawal from chronic cocaine self-administration.,"Learning & memory (Cold Spring Harbor, N.Y.)",2.0
1704,1594664,Calcagnetti,1992,Place conditioning reveals the rewarding aspect of social interaction in juvenile rats.,Physiology & behavior,2.0
1823,15091342,Bowers,2004,Activator of G protein signaling 3: a gatekeeper of cocaine sensitization and drug seeking.,Neuron,2.0
1864,18394927,Dhamala,2008,Analyzing information flow in brain networks with nonparametric Granger causality.,NeuroImage,2.0
1867,11008171,Deransart,2000,Dopamine in the striatum modulates seizures in a genetic model of absence epilepsy in the rat.,Neuroscience,2.0
1868,2682781,Rosenberg,1989,The Fourier approach to the identification of functional coupling between neuronal spike trains.,Progress in biophysics and molecular biology,2.0
1869,1822537,Jiang,1992,Membrane properties and synaptic responses of rat striatal neurones in vitro.,The Journal of physiology,2.0
1870,23209160,Hoffman,2014,Synaptic targets of Δ9-tetrahydrocannabinol in the central nervous system.,Cold Spring Harbor perspectives in medicine,2.0
1872,18412616,Schotanus,2008,Long-term potentiation in the nucleus accumbens requires both NR2A- and NR2B-containing N-methyl-D-aspartate receptors.,The European journal of neuroscience,2.0
1877,30673597,Rich,2020,Plasticity at Thalamo-amygdala Synapses Regulates Cocaine-Cue Memory Formation and Extinction.,Cell reports,2.0
1878,30415278,Luchkina,2019,Mechanisms of fear learning and extinction: synaptic plasticity-fear memory connection.,Psychopharmacology,2.0
1879,28324454,Cooper,2018,Reward Circuitry in Addiction.,Neurotherapeutics : the journal of the American Society for Experimental NeuroTherapeutics,2.0
1885,22343895,Lai,2012,Opposite effects of fear conditioning and extinction on dendritic spine remodelling.,Nature,2.0
1887,26403083,Holly,2016,Increased mesocorticolimbic dopamine during acute and repeated social defeat stress: modulation by corticotropin releasing factor receptors in the ventral tegmental area.,Psychopharmacology,2.0
1893,12895416,Ungless,2003,Corticotropin-releasing factor requires CRF binding protein to potentiate NMDA receptors via CRF receptor 2 in dopamine neurons.,Neuron,2.0
1895,12065616,Zapata,2002,D(3) receptor ligands modulate extracellular dopamine clearance in the nucleus accumbens.,Journal of neurochemistry,2.0
1899,27470168,Cheng,2018,Distinct Synaptic Strengthening of the Striatal Direct and Indirect Pathways Drives Alcohol Consumption.,Biological psychiatry,2.0
1900,26085274,Ramirez,2015,Activating positive memory engrams suppresses depression-like behaviour.,Nature,2.0
1902,21325435,Darvas,2011,Requirement of dopamine signaling in the amygdala and striatum for learning and maintenance of a conditioned avoidance response.,"Learning & memory (Cold Spring Harbor, N.Y.)",2.0
1904,20118184,Garcia,2010,Cortical regulation of striatal medium spiny neuron dendritic remodeling in parkinsonism: modulation of glutamate release reverses dopamine depletion-induced dendritic spine loss.,"Cerebral cortex (New York, N.Y. : 1991)",2.0
1861,21547982,Cohen,2012,Top-down-directed synchrony from medial frontal cortex to nucleus accumbens during reward anticipation.,Human brain mapping,2.0
1859,17283286,Hasler,2007,Reduced prefrontal glutamate/glutamine and gamma-aminobutyric acid levels in major depression determined using proton magnetic resonance spectroscopy.,Archives of general psychiatry,2.0
1858,21079608,Luscher,2011,The GABAergic deficit hypothesis of major depressive disorder.,Molecular psychiatry,2.0
1843,30503164,Steinman,2020,Complementary Neural Circuits for Divergent Effects of Oxytocin: Social Approach Versus Social Anxiety.,Biological psychiatry,2.0
1824,14750973,Miyamoto,2004,Behavioural adaptations to addictive drugs in mice lacking the NMDA receptor epsilon1 subunit.,The European journal of neuroscience,2.0
1826,12878694,Inoue,2003,Locus-specific rescue of GluRepsilon1 NMDA receptors in mutant mice identifies the brain regions important for morphine tolerance and dependence.,The Journal of neuroscience : the official journal of the Society for Neuroscience,2.0
1828,12522067,McGeehan,2003,The anti-relapse compound acamprosate inhibits the development of a conditioned place preference to ethanol and cocaine but not morphine.,British journal of pharmacology,2.0
1834,10210291,Suzuki,1999,Effects of the non-competitive NMDA receptor antagonist ifenprodil on the morphine-induced place preference in mice.,Life sciences,2.0
1835,9809860,Spanagel,1999,Acamprosate suppresses the expression of morphine-induced sensitization in rats but does not affect heroin self-administration or relapse induced by heroin or stress.,Psychopharmacology,2.0
1836,8593597,Kaddis,1996,DNQX in the nucleus accumbens inhibits cocaine-induced conditioned place preference.,Brain research,2.0
1840,1632582,Koob,1992,Neural mechanisms of drug reinforcement.,Annals of the New York Academy of Sciences,2.0
1844,29497149,Manvich,2019,The DREADD agonist clozapine N-oxide (CNO) is reverse-metabolized to clozapine and produces clozapine-like interoceptive stimulus effects in rats and mice.,Scientific reports,2.0
1856,23056528,Bai,2013,Abnormal hippocampal BDNF and miR-16 expression is associated with depression-like behaviors induced by stress during early life.,PloS one,2.0
1847,26204817,Felix-Ortiz,2016,Bidirectional modulation of anxiety-related and social behaviors by amygdala projections to the medial prefrontal cortex.,Neuroscience,2.0
1848,25904797,Parkes,2015,Interaction of insular cortex and ventral striatum mediates the effect of incentive memory on choice between goal-directed actions.,The Journal of neuroscience : the official journal of the Society for Neuroscience,2.0
1849,25100595,Willuhn,2014,Phasic dopamine release in the nucleus accumbens in response to pro-social 50 kHz ultrasonic vocalizations in rats.,The Journal of neuroscience : the official journal of the Society for Neuroscience,2.0
1850,21800319,O'Connell,2012,The vertebrate mesolimbic reward system and social behavior network: a comparative synthesis.,The Journal of comparative neurology,2.0
1852,9367719,Xiao,1998,Hormonal activation of the striatum and the nucleus accumbens modulates paced mating behavior in the female rat.,Hormones and behavior,2.0
1853,27457815,Seo,2018,Cellular and molecular basis for stress-induced depression.,Molecular psychiatry,2.0
1855,24089501,Tang,2013,Activation of synaptic group II metabotropic glutamate receptors induces long-term depression at GABAergic synapses in CNS neurons.,The Journal of neuroscience : the official journal of the Society for Neuroscience,2.0
1706,28562592,Amadei,2017,Dynamic corticostriatal activity biases social bonding in monogamous female prairie voles.,Nature,2.0
1701,12193179,Marinelli,2002,"Interaction between glucocorticoid hormones, stress and psychostimulant drugs.",The European journal of neuroscience,2.0
201,28018178,Gao,None,Associations of Unilateral Whisker and Olfactory Signals Induce Synapse Formation and Memory Cell Recruitment in Bilateral Barrel Cortices: Cellular Mechanism for Unilateral Training Toward Bilateral Memory.,Frontiers in cellular neuroscience,2.0
78,21420852,Kravitz,2011,Optogenetic manipulation of neural circuitry in vivo.,Current opinion in neurobiology,2.0
164,18639867,Belin,2009,Pattern of intake and drug craving predict the development of cocaine addiction-like behavior in rats.,Biological psychiatry,2.0
158,24305833,Schlosburg,2014,Long-term antagonism of κ opioid receptors prevents escalation of and increased motivation for heroin intake.,The Journal of neuroscience : the official journal of the Society for Neuroscience,2.0
145,12629161,Eyny,2003,Opposing roles of D1 and D2 receptors in appetitive conditioning.,The Journal of neuroscience : the official journal of the Society for Neuroscience,2.0
144,14750976,Yin,2004,Lesions of dorsolateral striatum preserve outcome expectancy but disrupt habit formation in instrumental learning.,The European journal of neuroscience,2.0
143,15833811,Dalley,2005,Time-limited modulation of appetitive Pavlovian memory by D1 and NMDA receptors in the nucleus accumbens.,Proceedings of the National Academy of Sciences of the United States of America,2.0
142,16237445,Barnes,2005,Activity of striatal neurons reflects dynamic encoding and recoding of procedural memories.,Nature,2.0
134,23827407,Cerovic,2014,Molecular and cellular mechanisms of dopamine-mediated behavioral plasticity in the striatum.,Neurobiology of learning and memory,2.0
131,24574988,Smith,2014,"Investigating habits: strategies, technologies and models.",Frontiers in behavioral neuroscience,2.0
123,1695400,Smith,1990,The neural network of the basal ganglia as revealed by the study of synaptic connections of identified neurones.,Trends in neurosciences,2.0
122,1789712,van der Laan,1992,Validation of spontaneous morphine withdrawal symptoms in rats.,Archives internationales de pharmacodynamie et de therapie,2.0
118,12373743,Robinson,2002,"Widespread but regionally specific effects of experimenter- versus self-administered morphine on dendritic spines in the nucleus accumbens, hippocampus, and neocortex of adult rats.","Synapse (New York, N.Y.)",2.0
116,15456835,Hjelmstad,2005,Dopamine excites nucleus accumbens neurons through the differential modulation of glutamate and GABA release.,The Journal of neuroscience : the official journal of the Society for Neuroscience,2.0
115,17105943,Diana,2007,Persistent and reversible morphine withdrawal-induced morphological changes in the nucleus accumbens.,Annals of the New York Academy of Sciences,2.0
113,19505571,Morales-Medina,2010,"Morphological reorganization after repeated corticosterone administration in the hippocampus, nucleus accumbens and amygdala in the rat.",Journal of chemical neuroanatomy,2.0
111,25083570,Chartoff,2015,Drug withdrawal conceptualized as a stressor.,Behavioural pharmacology,2.0
102,8986012,Carlezon,1997,Microinjections of phencyclidine (PCP) and related drugs into nucleus accumbens shell potentiate medial forebrain bundle brain stimulation reward.,Psychopharmacology,2.0
92,15921658,Stratford,2005,Activation of feeding-related neural circuitry after unilateral injections of muscimol into the nucleus accumbens shell.,Brain research,2.0
165,18546601,Schmittgen,2008,Analyzing real-time PCR data by the comparative C(T) method.,Nature protocols,2.0
166,16738231,Kenny,2006,Conditioned withdrawal drives heroin consumption and decreases reward sensitivity.,The Journal of neuroscience : the official journal of the Society for Neuroscience,2.0
167,14607079,Jacobs,2004,Neuroadaptive effects of active versus passive drug administration in addiction research.,Trends in pharmacological sciences,2.0
188,16415865,Day,2006,Selective elimination of glutamatergic synapses on striatopallidal neurons in Parkinson disease models.,Nature neuroscience,2.0
200,28070425,Yan,2017,Coordinated Plasticity between Barrel Cortical Glutamatergic and GABAergic Neurons during Associative Memory.,Neural plasticity,2.0
199,28408978,Wang,None,"Associative memory cells: Formation, function and perspective.",F1000Research,2.0
197,29487741,Wang,None,Associative memory cells and their working principle in the brain.,F1000Research,2.0
196,29864451,Sun,2019,microRNA and mRNA profiles in ventral tegmental area relevant to stress-induced depression and resilience.,Progress in neuro-psychopharmacology & biological psychiatry,2.0
194,2600625,Uchimura,1990,Inward rectification in rat nucleus accumbens neurons.,Journal of neurophysiology,2.0
191,9824848,Hevers,1999,The diversity of GABAA receptors. Pharmacological and electrophysiological properties of GABAA channel subtypes.,Molecular neurobiology,2.0
190,13679409,Shen,2004,Kv1.2-containing K+ channels regulate subthreshold excitability of striatal medium spiny neurons.,Journal of neurophysiology,2.0
187,16957088,Ortinski,2006,Deletion of the GABA(A) receptor alpha1 subunit increases tonic GABA(A) receptor current: a role for GABA uptake transporters.,The Journal of neuroscience : the official journal of the Society for Neuroscience,2.0
168,12055635,Ahmed,2002,Neurobiological evidence for hedonic allostasis associated with escalating cocaine use.,Nature neuroscience,2.0
186,17906621,Shen,2008,Cholinergic modulation of Kir2 channels selectively elevates dendritic excitability in striatopallidal neurons.,Nature neuroscience,2.0
180,20206233,Santhakumar,2010,Developmental regulation and neuroprotective effects of striatal tonic GABAA currents.,Neuroscience,2.0
176,22396414,Cazorla,2012,Striatal D2 receptors regulate dendritic morphology of medium spiny neurons via Kir2 channels.,The Journal of neuroscience : the official journal of the Society for Neuroscience,2.0
175,22581672,Forcelli,2012,Neonatal exposure to antiepileptic drugs disrupts striatal synaptic development.,Annals of neurology,2.0
174,24324407,Wójtowicz,2014,Reduced tonic inhibition in striatal output neurons from Huntington mice due to loss of astrocytic GABA release through GAT-3.,Frontiers in neural circuits,2.0
173,25264773,Ferreira,2014,Neuronal morphometry directly from bitmap images.,Nature methods,2.0
170,29315524,Al-Muhtasib,2018,Neonatal phenobarbital exposure disrupts GABAergic synaptic maturation in rat CA1 neurons.,Epilepsia,2.0
84,19793980,Tindell,2009,"Dynamic computation of incentive salience: ""wanting"" what was never ""liked"".",The Journal of neuroscience : the official journal of the Society for Neuroscience,2.0
70,24867334,Covelo,2015,"Manipulation of GABA in the ventral pallidum, but not the nucleus accumbens, induces intense, preferential, fat consumption in rats.",Behavioural brain research,2.0
1699,19150373,Ji,2009,MAP kinase and pain.,Brain research reviews,2.0
67,28751460,Warlow,2017,Optogenetic Central Amygdala Stimulation Intensifies and Narrows Motivation for Cocaine.,The Journal of neuroscience : the official journal of the Society for Neuroscience,2.0
1657,23125832,Min,2012,The computational power of astrocyte mediated synaptic plasticity.,Frontiers in computational neuroscience,2.0
1660,22366216,Stratford,2012,"Effects of muscimol, amphetamine, and DAMGO injected into the nucleus accumbens shell on food-reinforced lever pressing by undeprived rats.","Pharmacology, biochemistry, and behavior",2.0
1662,21632236,Koos,2011,"Glutamatergic signaling by midbrain dopaminergic neurons: recent insights from optogenetic, molecular and behavioral studies.",Current opinion in neurobiology,2.0
1664,21277908,Lin,2011,Memantine abolishes the formation of cocaine-induced conditioned place preference possibly via its IL-6-modulating effect in medial prefrontal cortex.,Behavioural brain research,2.0
