,pmid,author,year,title,journal,citedByNof1000
342,23177963,Britt,2013,Synaptic and behavioral profile of multiple glutamatergic inputs to the nucleus accumbens.,Neuron,54.0
79,20947769,Lobo,2010,Cell type-specific loss of BDNF signaling mimics optogenetic control of cocaine reward.,"Science (New York, N.Y.)",47.0
691,19675534,Sesack,2010,Cortico-Basal Ganglia reward network: microcircuitry.,Neuropsychopharmacology : official publication of the American College of Neuropsychopharmacology,44.0
366,18500330,Conrad,2008,Formation of accumbens GluR2-lacking AMPA receptors mediates incubation of cocaine craving.,Nature,44.0
6,25251489,Floresco,2015,"The nucleus accumbens: an interface between cognition, emotion, and action.",Annual review of psychology,42.0
40,6999537,Mogenson,1980,From motivation to action: functional interface between the limbic system and the motor system.,Progress in neurobiology,36.0
671,19710631,Koob,2010,Neurocircuitry of addiction.,Neuropsychopharmacology : official publication of the American College of Neuropsychopharmacology,34.0
373,16776597,Hyman,2006,Neural mechanisms of addiction: the role of reward-related learning and memory.,Annual review of neuroscience,32.0
1226,16055761,Kalivas,2005,The neural basis of addiction: a pathology of motivation and choice.,The American journal of psychiatry,31.0
654,21338877,Lüscher,2011,Drug-evoked synaptic plasticity in addiction: from molecular changes to circuit remodeling.,Neuron,30.0
668,23428656,Smith,2014,Cocaine-induced adaptations in D1 and D2 accumbens projection neurons (a dichotomy not necessarily synonymous with direct and indirect pathways).,Current opinion in neurobiology,30.0
172,26214370,Kupchik,2015,Coding the direct/indirect pathways by D1 and D2 receptors is not valid for accumbens projections.,Nature neuroscience,30.0
104,7751934,O'Donnell,1995,Synaptic interactions among excitatory afferents to nucleus accumbens neurons: hippocampal gating of prefrontal cortical input.,The Journal of neuroscience : the official journal of the Society for Neuroscience,29.0
36,10415642,Groenewegen,1999,Convergence and segregation of ventral striatal inputs and outputs.,Annals of the New York Academy of Sciences,29.0
252,20207024,Russo,2010,The addicted synapse: mechanisms of synaptic and structural plasticity in nucleus accumbens.,Trends in neurosciences,29.0
26,17574681,Ikemoto,2008,Dopamine reward circuitry: two projection systems from the ventral midbrain to the nucleus accumbens-olfactory tubercle complex.,Brain research reviews,29.0
582,21811439,Lobo,2011,The striatal balancing act in drug addiction: distinct roles of direct and indirect pathway medium spiny neurons.,Frontiers in neuroanatomy,28.0
649,24848058,Pascoli,2014,Contrasting forms of cocaine-evoked plasticity control components of relapse.,Nature,28.0
108,2057066,Heimer,1991,Specificity in the projection patterns of accumbal core and shell in the rat.,Neuroscience,27.0
1029,8401595,Robinson,1993,The neural basis of drug craving: an incentive-sensitization theory of addiction.,Brain research. Brain research reviews,27.0
709,24077564,Lee,2013,Maturation of silent synapses in amygdala-accumbens projection contributes to incubation of cocaine craving.,Nature neuroscience,27.0
717,21716290,Stuber,2011,Excitatory transmission from the amygdala to nucleus accumbens facilitates reward seeking.,Nature,25.0
17,21543612,Ambroggi,2011,Roles of nucleus accumbens core and shell in incentive-cue responding and behavioral inhibition.,The Journal of neuroscience : the official journal of the Society for Neuroscience,25.0
655,19571793,Kalivas,2009,The glutamate homeostasis hypothesis of addiction.,Nature reviews. Neuroscience,25.0
354,21392532,Yorgason,2012,Demon voltammetry and analysis software: analysis of cocaine-induced alterations in dopamine signaling using multiple kinetic measures.,Journal of neuroscience methods,23.0
1720,1448200,Zahm,1992,"On the significance of subterritories in the ""accumbens"" part of the rat ventral striatum.",Neuroscience,23.0
521,15152198,Wise,2004,"Dopamine, learning and motivation.",Nature reviews. Neuroscience,23.0
735,25173629,Francis,2015,Nucleus accumbens medium spiny neuron subtypes mediate depression-related outcomes to social defeat stress.,Biological psychiatry,23.0
1185,25720819,Salgado,None,The Nucleus Accumbens: A Comprehensive Review.,Stereotactic and functional neurosurgery,23.0
932,15721244,Roitman,2005,"Nucleus accumbens neurons are innately tuned for rewarding and aversive taste stimuli, encode their predictors, and are linked to motor output.",Neuron,23.0
1508,8308171,Brog,1994,"The patterns of afferent innervation of the core and shell in the ""accumbens"" part of the rat ventral striatum: immunohistochemical detection of retrogradely transported fluoro-gold.",The Journal of comparative neurology,23.0
1359,16251991,Everitt,2006,Neural systems of reinforcement for drug addiction: from actions to habits to compulsion.,Nature neuroscience,22.0
1310,25199705,Ma,2015,Bidirectional modulation of incubation of cocaine craving by silent synapse-based remodeling of prefrontal cortex to accumbens projections.,Neuron,22.0
353,21469956,Gerfen,2011,Modulation of striatal projection systems by dopamine.,Annual review of neuroscience,22.0
1147,2899326,Di Chiara,1988,Drugs abused by humans preferentially increase synaptic dopamine concentrations in the mesolimbic system of freely moving rats.,Proceedings of the National Academy of Sciences of the United States of America,22.0
1245,20620875,Hikida,2010,Distinct roles of synaptic transmission in direct and indirect striatal pathways to reward and aversive behavior.,Neuron,22.0
711,23542690,Bock,2013,Strengthening the accumbal indirect pathway promotes resilience to compulsive cocaine use.,Nature neuroscience,21.0
86,18675281,Carlezon,2009,Biological substrates of reward and aversion: a nucleus accumbens activity hypothesis.,Neuropharmacology,21.0
722,20056891,Maze,2010,Essential role of the histone methyltransferase G9a in cocaine-induced plasticity.,"Science (New York, N.Y.)",21.0
716,22544310,Kravitz,2012,Distinct roles for direct and indirect pathway striatal neurons in reinforcement.,Nature neuroscience,21.0
347,22794260,Threlfell,2012,Striatal dopamine release is triggered by synchronized activity in cholinergic interneurons.,Neuron,21.0
1781,21764143,Pickens,2011,Neurobiology of the incubation of drug craving.,Trends in neurosciences,21.0
726,11694884,Thomas,2002,Long-term depression in the nucleus accumbens: a neural correlate of behavioral sensitization to cocaine.,Nature neuroscience,21.0
82,20357125,Krause,2010,A pause in nucleus accumbens neuron firing is required to initiate and maintain feeding.,The Journal of neuroscience : the official journal of the Society for Neuroscience,20.0
853,17652583,Kourrich,2007,Cocaine experience controls bidirectional synaptic plasticity in the nucleus accumbens.,The Journal of neuroscience : the official journal of the Society for Neuroscience,20.0
346,22840394,Cachope,2013,Selective activation of cholinergic interneurons enhances accumbal phasic dopamine release: setting the tone for reward processing.,Cell reports,20.0
295,18509028,Bertran-Gonzalez,2008,Opposing patterns of signaling activation in dopamine D1 and D2 receptor-expressing striatal neurons in response to cocaine and haloperidol.,The Journal of neuroscience : the official journal of the Society for Neuroscience,20.0
229,22785313,Lim,2012,Anhedonia requires MC4R-mediated synaptic adaptations in nucleus accumbens.,Nature,19.0
713,23319622,Grueter,2013,∆FosB differentially modulates nucleus accumbens direct and indirect pathway function.,Proceedings of the National Academy of Sciences of the United States of America,19.0
927,16354936,Peciña,2006,Hedonic hot spot in nucleus accumbens shell: where do mu-opioids cause increased hedonic impact of sweetness?,The Journal of neuroscience : the official journal of the Society for Neuroscience,19.0
706,26831103,Calipari,2016,In vivo imaging identifies temporal signature of D1 and D2 medium spiny neurons in cocaine reward.,Proceedings of the National Academy of Sciences of the United States of America,18.0
358,20554874,Stuber,2010,Dopaminergic terminals in the nucleus accumbens but not the dorsal striatum corelease glutamate.,The Journal of neuroscience : the official journal of the Society for Neuroscience,18.0
532,9054347,Schultz,1997,A neural substrate of prediction and reward.,"Science (New York, N.Y.)",18.0
350,22158102,Pascoli,2012,Reversal of cocaine-evoked synaptic potentiation resets drug-induced adaptive behaviour.,Nature,18.0
42,27871668,Francis,2017,Emerging Role for Nucleus Accumbens Medium Spiny Neuron Subtypes in Depression.,Biological psychiatry,18.0
1951,17072591,Berridge,2007,The debate over dopamine's role in reward: the case for incentive salience.,Psychopharmacology,18.0
723,18760700,Ambroggi,2008,Basolateral amygdala neurons facilitate reward-seeking behavior by exciting nucleus accumbens neurons.,Neuron,18.0
249,20473292,Vialou,2010,DeltaFosB in brain reward circuits mediates resilience to stress and antidepressant responses.,Nature neuroscience,17.0
178,21076424,Grueter,2011,Postsynaptic TRPV1 triggers cell type-specific long-term depression in the nucleus accumbens.,Nature neuroscience,17.0
103,7938546,Pennartz,1994,"The nucleus accumbens as a complex of functionally distinct neuronal ensembles: an integration of behavioural, electrophysiological and anatomical data.",Progress in neurobiology,17.0
840,24259563,Lobo,2014,"ΔFosB induction in striatal medium spiny neuron subtypes in response to chronic pharmacological, emotional, and optogenetic stimuli.",The Journal of neuroscience : the official journal of the Society for Neuroscience,17.0
117,15034590,Ito,2004,Differential control over cocaine-seeking behavior by nucleus accumbens core and shell.,Nature neuroscience,17.0
1363,12716962,McFarland,2003,Prefrontal glutamate release into the core of the nucleus accumbens mediates cocaine-induced reinstatement of drug-seeking behavior.,The Journal of neuroscience : the official journal of the Society for Neuroscience,17.0
138,22780554,Saunders,2012,The role of dopamine in the accumbens core in the expression of Pavlovian-conditioned responses.,The European journal of neuroscience,17.0
985,26585289,Terrier,2018,"Cell-Type Specific Insertion of GluA2-Lacking AMPARs with Cocaine Exposure Leading to Sensitization, Cue-Induced Seeking, and Incubation of Craving.",Neuropsychopharmacology : official publication of the American College of Neuropsychopharmacology,17.0
377,15464140,Di Chiara,2004,Dopamine and drug addiction: the nucleus accumbens shell connection.,Neuropharmacology,17.0
855,16207873,Boudreau,2005,Behavioral sensitization to cocaine is associated with increased AMPA receptor surface expression in the nucleus accumbens.,The Journal of neuroscience : the official journal of the Society for Neuroscience,17.0
48,16566899,Nestler,2006,The mesolimbic dopamine reward circuit in depression.,Biological psychiatry,17.0
728,2147780,Gerfen,1991,D1 and D2 dopamine receptor-regulated gene expression of striatonigral and striatopallidal neurons.,"Science (New York, N.Y.)",16.0
317,26335648,Al-Hasani,2015,Distinct Subpopulations of Nucleus Accumbens Dynorphin Neurons Drive Aversion and Reward.,Neuron,16.0
334,24647944,Castro,2014,"Opioid hedonic hotspot in nucleus accumbens shell: mu, delta, and kappa maps for enhancement of sweetness ""liking"" and ""wanting"".",The Journal of neuroscience : the official journal of the Society for Neuroscience,16.0
22,19812543,Haber,2010,The reward circuit: linking primate anatomy and human imaging.,Neuropsychopharmacology : official publication of the American College of Neuropsychopharmacology,16.0
1531,11606653,McFarland,2001,The circuitry mediating cocaine-induced reinstatement of drug-seeking behavior.,The Journal of neuroscience : the official journal of the Society for Neuroscience,16.0
1709,20655604,Wolf,2010,The Bermuda Triangle of cocaine-induced neuroadaptations.,Trends in neurosciences,16.0
725,16492766,Lee,2006,Cocaine-induced dendritic spine formation in D1 and D2 dopamine receptor-containing medium spiny neurons in nucleus accumbens.,Proceedings of the National Academy of Sciences of the United States of America,16.0
514,17603481,Day,2007,Associative learning mediates dynamic shifts in dopamine signaling in the nucleus accumbens.,Nature neuroscience,16.0
593,26276628,Volkow,2016,The Brain on Drugs: From Reward to Addiction.,Cell,16.0
141,21150898,Flagel,2011,A selective role for dopamine in stimulus-reward learning.,Nature,16.0
1337,21490215,McCutcheon,2011,Calcium-permeable AMPA receptors are present in nucleus accumbens synapses after prolonged withdrawal from cocaine self-administration but not experimenter-administered cocaine.,The Journal of neuroscience : the official journal of the Society for Neuroscience,16.0
745,15271494,Voorn,2004,Putting a spin on the dorsal-ventral divide of the striatum.,Trends in neurosciences,16.0
558,18786735,Goto,2009,Limbic and cortical information processing in the nucleus accumbens.,Trends in neurosciences,15.0
105,7472436,Maldonado-Irizarry,1995,Glutamate receptors in the nucleus accumbens shell control feeding behavior via the lateral hypothalamus.,The Journal of neuroscience : the official journal of the Society for Neuroscience,15.0
96,12177226,Reynolds,2002,"Positive and negative motivation in nucleus accumbens shell: bivalent rostrocaudal gradients for GABA-elicited eating, taste ""liking""/""disliking"" reactions, place preference/avoidance, and fear.",The Journal of neuroscience : the official journal of the Society for Neuroscience,15.0
1372,10499584,Kelz,1999,Expression of the transcription factor deltaFosB in the brain controls sensitivity to cocaine.,Nature,15.0
710,24072923,Bocklisch,2013,Cocaine disinhibits dopamine neurons by potentiation of GABA transmission in the ventral tegmental area.,"Science (New York, N.Y.)",15.0
2434,21209217,Christoffel,2011,IκB kinase regulates social defeat stress-induced synaptic and behavioral plasticity.,The Journal of neuroscience : the official journal of the Society for Neuroscience,15.0
1773,22754497,Wolf,2012,"Calcium-permeable AMPA receptors in the VTA and nucleus accumbens after cocaine exposure: when, how, and why?",Frontiers in molecular neuroscience,15.0
83,19941931,Humphries,2010,"The ventral basal ganglia, a selection mechanism at the crossroads of space, strategy, and reward.",Progress in neurobiology,15.0
524,12687000,Phillips,2003,Subsecond dopamine release promotes cocaine seeking.,Nature,15.0
1252,15464124,Robinson,2004,Structural plasticity associated with exposure to drugs of abuse.,Neuropharmacology,15.0
3259,24758366,Feng,2015,Chronic cocaine-regulated epigenomic changes in mouse nucleus accumbens.,Genome biology,14.0
850,19295158,Russo,2009,Nuclear factor kappa B signaling regulates neuronal morphology and cocaine reward.,The Journal of neuroscience : the official journal of the Society for Neuroscience,14.0
719,21377654,Kim,2011,Cell type-specific alterations in the nucleus accumbens by repeated exposures to cocaine.,Biological psychiatry,14.0
2198,11449260,Grimm,2001,Neuroadaptation. Incubation of cocaine craving after withdrawal.,Nature,14.0
1685,9858756,Berridge,1999,"What is the role of dopamine in reward: hedonic impact, reward learning, or incentive salience?",Brain research. Brain research reviews,14.0
1325,23467346,Robison,2013,Behavioral and structural responses to chronic cocaine require a feedforward loop involving ΔFosB and calcium/calmodulin-dependent protein kinase II in the nucleus accumbens shell.,The Journal of neuroscience : the official journal of the Society for Neuroscience,14.0
101,9151760,Stratford,1997,GABA in the nucleus accumbens shell participates in the central regulation of feeding behavior.,The Journal of neuroscience : the official journal of the Society for Neuroscience,14.0
100,9483534,Lu,1998,"Expression of D1 receptor, D2 receptor, substance P and enkephalin messenger RNAs in the neurons projecting from the nucleus accumbens.",Neuroscience,14.0
984,26739562,Hearing,2016,Reversal of morphine-induced cell-type-specific synaptic plasticity in the nucleus accumbens shell blocks reinstatement.,Proceedings of the National Academy of Sciences of the United States of America,14.0
97,11312311,Reynolds,2001,Fear and feeding in the nucleus accumbens shell: rostrocaudal segregation of GABA-elicited defensive behavior versus eating behavior.,The Journal of neuroscience : the official journal of the Society for Neuroscience,14.0
1687,9276840,Heimer,1997,The accumbens: beyond the core-shell dichotomy.,The Journal of neuropsychiatry and clinical neurosciences,14.0
2349,8618890,Pontieri,1996,"Intravenous cocaine, morphine, and amphetamine preferentially increase extracellular dopamine in the ""shell"" as compared with the ""core"" of the rat nucleus accumbens.",Proceedings of the National Academy of Sciences of the United States of America,14.0
511,18753384,Aragona,2008,Preferential enhancement of dopamine transmission within the nucleus accumbens shell by cocaine is attributable to a direct increase in phasic dopamine release events.,The Journal of neuroscience : the official journal of the Society for Neuroscience,14.0
1346,19607791,Huang,2009,In vivo cocaine experience generates silent synapses.,Neuron,14.0
1366,12060781,Robbe,2002,Endogenous cannabinoids mediate long-term synaptic depression in the nucleus accumbens.,Proceedings of the National Academy of Sciences of the United States of America,14.0
89,18256852,Meredith,2008,The structural basis for mapping behavior onto the ventral striatum and its subdivisions.,Brain structure & function,14.0
522,14960596,Roitman,2004,Dopamine operates as a subsecond modulator of food seeking.,The Journal of neuroscience : the official journal of the Society for Neuroscience,14.0
851,19136971,Moussawi,2009,N-Acetylcysteine reverses cocaine-induced metaplasticity.,Nature neuroscience,14.0
1159,21849539,Corbit,2011,The general and outcome-specific forms of Pavlovian-instrumental transfer are differentially mediated by the nucleus accumbens core and shell.,The Journal of neuroscience : the official journal of the Society for Neuroscience,13.0
135,23764290,McGinty,2013,Invigoration of reward seeking by cue and proximity encoding in the nucleus accumbens.,Neuron,13.0
137,23141060,Salamone,2013,The mysterious motivational functions of mesolimbic dopamine.,Neuron,13.0
1207,16983543,Nicola,2007,The nucleus accumbens as part of a basal ganglia action selection circuit.,Psychopharmacology,13.0
1610,26674863,Hodes,2016,Sex Differences in Nucleus Accumbens Transcriptome Profiles Associated with Susceptibility versus Resilience to Subchronic Variable Stress.,The Journal of neuroscience : the official journal of the Society for Neuroscience,13.0
860,8778304,Pierce,1996,Repeated cocaine augments excitatory amino acid transmission in the nucleus accumbens only in rats having developed behavioral sensitization.,The Journal of neuroscience : the official journal of the Society for Neuroscience,13.0
566,11312310,Corbit,2001,The role of the nucleus accumbens in instrumental conditioning: Evidence of a functional dissociation between accumbens core and shell.,The Journal of neuroscience : the official journal of the Society for Neuroscience,13.0
565,11375482,Cardinal,2001,Impulsive choice induced in rats by lesions of the nucleus accumbens core.,"Science (New York, N.Y.)",13.0
992,23727437,Loweth,2014,Adaptations in AMPA receptor transmission in the nucleus accumbens contributing to incubation of cocaine craving.,Neuropharmacology,13.0
1740,22956831,Trantham-Davidson,2012,"Ceftriaxone normalizes nucleus accumbens synaptic transmission, glutamate transport, and export following cocaine self-administration and extinction training.",The Journal of neuroscience : the official journal of the Society for Neuroscience,13.0
1429,20729844,LaPlant,2010,Dnmt3a regulates emotional behavior and spine plasticity in the nucleus accumbens.,Nature neuroscience,13.0
534,6816390,Swanson,1983,The projections of the ventral tegmental area and adjacent regions: a combined fluorescent retrograde tracer and immunofluorescence study in the rat.,Brain research bulletin,13.0
1792,19597494,Mameli,2009,Cocaine-evoked synaptic plasticity: persistence in the VTA triggers adaptations in the NAc.,Nature neuroscience,13.0
1455,21147998,Nicola,2011,The flexible approach hypothesis: unification of effort and cue-responding hypotheses for the role of nucleus accumbens dopamine in the activation of reward-seeking behavior.,The Journal of neuroscience : the official journal of the Society for Neuroscience,13.0
128,25339748,du Hoffmann,2015,Dopamine invigorates reward seeking by promoting cue-evoked excitation in the nucleus accumbens.,The Journal of neuroscience : the official journal of the Society for Neuroscience,13.0
3241,23495790,Peciña,2013,Dopamine or opioid stimulation of nucleus accumbens similarly amplify cue-triggered 'wanting' for reward: entire core and medial shell mapped as substrates for PIT enhancement.,The European journal of neuroscience,13.0
69,26593092,O'Connor,2016,Accumbal D1R Neurons Projecting to Lateral Hypothalamus Authorize Feeding.,Neuron,13.0
1273,20109488,Wolf,2011,AMPA receptor plasticity in the nucleus accumbens after repeated exposure to cocaine.,Neuroscience and biobehavioral reviews,13.0
1884,23416703,Golden,2013,Epigenetic regulation of RAC1 induces synaptic remodeling in stress disorders and depression.,Nature medicine,13.0
1335,21994370,McCutcheon,2011,Group I mGluR activation reverses cocaine-induced accumulation of calcium-permeable AMPA receptors in nucleus accumbens synapses via a protein kinase C-dependent mechanism.,The Journal of neuroscience : the official journal of the Society for Neuroscience,13.0
644,27475769,Koob,2017,Neurobiology of addiction: a neurocircuitry analysis.,The lancet. Psychiatry,13.0
120,10215912,Robinson,1999,Alterations in the morphology of dendrites and dendritic spines in the nucleus accumbens and prefrontal cortex following repeated treatment with amphetamine or cocaine.,The European journal of neuroscience,13.0
1005,3683859,Groenewegen,1988,Organization of the projections from the subiculum to the ventral striatum in the rat. A study using anterograde transport of Phaseolus vulgaris leucoagglutinin.,Neuroscience,12.0
946,10704511,Haber,2000,Striatonigrostriatal pathways in primates form an ascending spiral from the shell to the dorsolateral striatum.,The Journal of neuroscience : the official journal of the Society for Neuroscience,12.0
2899,16307603,Pothuizen,2006,Double dissociation of the effects of selective nucleus accumbens core and shell lesions on impulsive-choice behaviour and salience learning in rats.,The European journal of neuroscience,12.0
110,27239940,Graziane,2017,Opposing mechanisms mediate morphine- and cocaine-induced generation of silent synapses.,Nature neuroscience,12.0
531,9658025,Schultz,1998,Predictive reward signal of dopamine neurons.,Journal of neurophysiology,12.0
291,21510962,Wissman,2012,Sex differences and effects of cocaine on excitatory synapses in the nucleus accumbens.,Neuropharmacology,12.0
1488,10415646,Zahm,1999,Functional-anatomical implications of the nucleus accumbens core and shell subterritories.,Annals of the New York Academy of Sciences,12.0
2143,18003845,Bossert,2007,Differential effects of blockade of dopamine D1-family receptors in nucleus accumbens core or shell on reinstatement of heroin seeking induced by contextual and discrete cues.,The Journal of neuroscience : the official journal of the Society for Neuroscience,12.0
999,20576893,Kasanetz,2010,Transition to addiction is associated with a persistent impairment in synaptic plasticity.,"Science (New York, N.Y.)",12.0
1244,21632938,Brown,2011,A silent synapse-based mechanism for cocaine-induced locomotor sensitization.,The Journal of neuroscience : the official journal of the Society for Neuroscience,12.0
996,20947635,Jeanes,2011,In vivo chronic intermittent ethanol exposure reverses the polarity of synaptic plasticity in the nucleus accumbens shell.,The Journal of pharmacology and experimental therapeutics,12.0
156,21131952,Ferguson,2011,Transient neuronal inhibition reveals opposing roles of indirect and direct pathways in sensitization.,Nature neuroscience,12.0
3194,21264647,Stopper,2011,Contributions of the nucleus accumbens and its subregions to different aspects of risk-based decision making.,"Cognitive, affective & behavioral neuroscience",12.0
800,1665095,Kalivas,1992,Dopamine transmission in the initiation and expression of drug- and stress-induced sensitization of motor activity.,Brain research. Brain research reviews,12.0
933,15689556,Taha,2005,Encoding of palatability and appetitive behaviors by distinct neuronal populations in the nucleus accumbens.,The Journal of neuroscience : the official journal of the Society for Neuroscience,12.0
945,10773195,Peciña,2000,Opioid site in nucleus accumbens shell mediates eating and hedonic 'liking' for food: map based on microinjection Fos plumes.,Brain research,12.0
2100,21303898,Beaulieu,2011,"The physiology, signaling, and pharmacology of dopamine receptors.",Pharmacological reviews,12.0
1264,26030846,Christoffel,2015,Excitatory transmission at thalamo-striatal synapses mediates susceptibility to social stress.,Nature neuroscience,12.0
1676,16289609,Kelley,2006,"Corticostriatal-hypothalamic circuitry and food motivation: integration of energy, action and reward.",Physiology & behavior,12.0
581,23473317,Gipson,2013,"Relapse induced by cues predicting cocaine depends on rapid, transient synaptic potentiation.",Neuron,12.0
