,pmid,author,year,title,journal,citedByNof1000
1051,12640666,Pinto,2003,Projections from the paraventricular nucleus of the thalamus to the rat prefrontal cortex and nucleus accumbens shell: ultrastructural characteristics and spatial relationships with dopamine afferents.,The Journal of comparative neurology,4.0
4630,23475113,Kennedy,2013,Class I HDAC inhibition blocks cocaine-induced plasticity by targeted changes in histone methylation.,Nature neuroscience,4.0
4326,23332758,Kourrich,2013,Dynamic interaction between sigma-1 receptor and Kv1.2 shapes neuronal and behavioral responses to cocaine.,Cell,4.0
543,24801491,Schmitt,2015,Safety and feasibility of nucleus accumbens stimulation in five patients with epilepsy.,Journal of neurology,4.0
789,11002906,Robinson,2000,The psychology and neurobiology of addiction: an incentive-sensitization view.,"Addiction (Abingdon, England)",4.0
845,22957495,Bu,2013,Transcriptome analysis of long non-coding RNAs of the nucleus accumbens in cocaine-conditioned mice.,Journal of neurochemistry,4.0
858,15266353,Suto,2005,Previous exposure to psychostimulants enhances the reinstatement of cocaine seeking by nucleus accumbens AMPA.,Neuropsychopharmacology : official publication of the American College of Neuropsychopharmacology,4.0
544,23678119,Zaehle,2013,Nucleus accumbens activity dissociates different forms of salience: evidence from human intracranial recordings.,The Journal of neuroscience : the official journal of the Society for Neuroscience,4.0
549,21253357,Oostenveld,2011,"FieldTrip: Open source software for advanced analysis of MEG, EEG, and invasive electrophysiological data.",Computational intelligence and neuroscience,4.0
4711,17884016,Diergaarde,2008,Impulsive choice and impulsive action predict vulnerability to distinct stages of nicotine seeking in rats.,Biological psychiatry,4.0
271,15691526,Torrey,2005,"Neurochemical markers for schizophrenia, bipolar disorder, and major depression in postmortem brains.",Biological psychiatry,4.0
182,19386907,Janssen,2009,Dopamine modulation of GABA tonic conductance in striatal output neurons.,The Journal of neuroscience : the official journal of the Society for Neuroscience,4.0
547,22623676,Patel,2012,Single-neuron responses in the human nucleus accumbens during a financial decision-making task.,The Journal of neuroscience : the official journal of the Society for Neuroscience,4.0
1069,9309321,Hodge,1997,Alcohol self-administration: further examination of the role of dopamine receptors in the nucleus accumbens.,"Alcoholism, clinical and experimental research",4.0
540,314832,Beckstead,1979,Efferent connections of the substantia nigra and ventral tegmental area in the rat.,Brain research,4.0
570,28123013,Heinsbroek,2017,Loss of Plasticity in the D2-Accumbens Pallidal Pathway Promotes Cocaine Seeking.,The Journal of neuroscience : the official journal of the Society for Neuroscience,4.0
571,27235078,Soares-Cunha,2017,Reappraising striatal D1- and D2-neurons in reward and aversion.,Neuroscience and biobehavioral reviews,4.0
4728,9491897,Sakurai,1998,Orexins and orexin receptors: a family of hypothalamic neuropeptides and G protein-coupled receptors that regulate feeding behavior.,Cell,4.0
263,17851537,Pittenger,2008,"Stress, depression, and neuroplasticity: a convergence of mechanisms.",Neuropsychopharmacology : official publication of the American College of Neuropsychopharmacology,4.0
4412,16972104,Pattij,2007,Involvement of dopamine D1 and D2 receptors in the nucleus accumbens core and shell in inhibitory response control.,Psychopharmacology,4.0
774,18619984,Schroeder,2009,Cue-induced reinstatement of alcohol-seeking behavior is associated with increased ERK1/2 phosphorylation in specific limbic brain regions: blockade by the mGluR5 antagonist MPEP.,Neuropharmacology,4.0
976,1349255,Zahm,1992,An electron microscopic morphometric comparison of tyrosine hydroxylase immunoreactive innervation in the neostriatum and the nucleus accumbens core and shell.,Brain research,4.0
161,21708909,Eipper-Mains,2011,microRNA-Seq reveals cocaine-regulated expression of striatal microRNAs.,"RNA (New York, N.Y.)",4.0
580,23639436,Gipson,2014,"Rapid, transient synaptic plasticity in addiction.",Neuropharmacology,4.0
204,27427907,Ma,2017,Molecular Mechanism for Stress-Induced Depression Assessed by Sequencing miRNA and mRNA in Medial Prefrontal Cortex.,PloS one,4.0
520,15944133,Stuber,2005,Extinction of cocaine self-administration reveals functionally and temporally distinct dopaminergic signals in the nucleus accumbens.,Neuron,4.0
155,21368124,Beutler,2011,Balanced NMDA receptor activity in dopamine D1 receptor (D1R)- and D2R-expressing medium spiny neurons is required for amphetamine sensitization.,Proceedings of the National Academy of Sciences of the United States of America,4.0
206,26506857,Xu,2018,Incoordination among Subcellular Compartments Is Associated with Depression-Like Behavior Induced by Chronic Mild Stress.,The international journal of neuropsychopharmacology,4.0
944,10835636,Filliol,2000,Mice deficient for delta- and mu-opioid receptors exhibit opposing alterations of emotional responses.,Nature genetics,4.0
942,11035216,Brown,2000,The rewarding properties of neuropeptide Y in perifornical hypothalamus vs. nucleus accumbens.,Peptides,4.0
618,26341938,Wassum,2016,The basolateral amygdala in reward learning and addiction.,Neuroscience and biobehavioral reviews,4.0
369,17868902,Shippenberg,2008,Dynorphin and the pathophysiology of drug addiction.,Pharmacology & therapeutics,4.0
63,30146308,Reed,2019,Coordinated Reductions in Excitatory Input to the Nucleus Accumbens Underlie Food Consumption.,Neuron,4.0
304,8158125,Thompson,1994,Estrogen regulation of dopamine release in the nucleus accumbens: genomic- and nongenomic-mediated effects.,Journal of neurochemistry,4.0
4397,19015660,Wang,2009,RNA-Seq: a revolutionary tool for transcriptomics.,Nature reviews. Genetics,4.0
828,10627585,Banke,2000,Control of GluR1 AMPA receptor function by cAMP-dependent protein kinase.,The Journal of neuroscience : the official journal of the Society for Neuroscience,4.0
642,28114294,Edwards,2017,Circuit specificity in the inhibitory architecture of the VTA regulates cocaine-induced behavior.,Nature neuroscience,4.0
695,15504328,Carter,2005,State-dependent calcium signaling in dendritic spines of striatal medium spiny neurons.,Neuron,4.0
4354,7393973,Roberts,1980,Extinction and recovery of cocaine self-administration following 6-hydroxydopamine lesions of the nucleus accumbens.,"Pharmacology, biochemistry, and behavior",4.0
647,25082707,Hu,2014,"Interneurons. Fast-spiking, parvalbumin⁺ GABAergic interneurons: from cellular design to microcircuit function.","Science (New York, N.Y.)",4.0
693,17108154,Yin,2006,The role of protein synthesis in striatal long-term depression.,The Journal of neuroscience : the official journal of the Society for Neuroscience,4.0
4293,15922019,Anderson,2006,Cocaine-induced alterations in dopamine receptor signaling: implications for reinforcement and reinstatement.,Pharmacology & therapeutics,4.0
650,24843012,Tritsch,2015,"Midbrain dopamine neurons sustain inhibitory transmission using plasma membrane uptake of GABA, not synthesis.",eLife,4.0
1139,14737224,Heien,2004,Overoxidation of carbon-fiber microelectrodes enhances dopamine adsorption and increases sensitivity.,The Analyst,4.0
651,23892554,Mathur,2013,Voltage drives diverse endocannabinoid signals to mediate striatal microcircuit-specific plasticity.,Nature neuroscience,4.0
692,18647613,Russo,2009,Neurotrophic factors and structural plasticity in addiction.,Neuropharmacology,4.0
1011,23463152,Ho,2014,An orexin hotspot in ventral pallidum amplifies hedonic 'liking' for sweetness.,Neuropsychopharmacology : official publication of the American College of Neuropsychopharmacology,4.0
686,23136424,Ben Hamida,2013,The small G protein H-Ras in the mesolimbic system is a molecular gateway to alcohol-seeking and excessive drinking behaviors.,The Journal of neuroscience : the official journal of the Society for Neuroscience,4.0
887,24908491,Atallah,2014,Neurons in the ventral striatum exhibit cell-type-specific representations of outcome during learning.,Neuron,4.0
1144,9482784,Jones,1998,Mechanisms of amphetamine action revealed in mice lacking the dopamine transporter.,The Journal of neuroscience : the official journal of the Society for Neuroscience,4.0
14,22248573,Fischl,2012,FreeSurfer.,NeuroImage,4.0
890,24413699,Cui,2014,Targeted expression of μ-opioid receptors in a subset of striatal direct-pathway neurons restores opiate reward.,Nature neuroscience,4.0
816,20401643,Toda,2011,Inhibition of actin polymerization prevents cocaine-induced changes in spine morphology in the nucleus accumbens.,Neurotoxicity research,4.0
328,25533038,Brimblecombe,2015,"Gating of dopamine transmission by calcium and axonal N-, Q-, T- and L-type voltage-gated calcium channels differs between striatal domains.",The Journal of physiology,4.0
1003,15483559,Fuchs,2005,"The role of the dorsomedial prefrontal cortex, basolateral amygdala, and dorsal hippocampus in contextual reinstatement of cocaine seeking in rats.",Neuropsychopharmacology : official publication of the American College of Neuropsychopharmacology,4.0
322,25762676,Whitfield,2015,κ Opioid receptors in the nucleus accumbens shell mediate escalation of methamphetamine intake.,The Journal of neuroscience : the official journal of the Society for Neuroscience,4.0
669,23352169,Whitaker,2013,Social deprivation enhances VTA synaptic plasticity and drug-induced contextual learning.,Neuron,4.0
11,23184995,Navratilova,2013,Pain relief produces negative reinforcement through activation of mesolimbic reward-valuation circuitry.,Proceedings of the National Academy of Sciences of the United States of America,4.0
5,25834050,Lee,2015,Activation of corticostriatal circuitry relieves chronic neuropathic pain.,The Journal of neuroscience : the official journal of the Society for Neuroscience,4.0
1151,24858182,Burton,2015,From ventral-medial to dorsal-lateral striatum: neural correlates of reward-guided decision-making.,Neurobiology of learning and memory,4.0
326,25611513,Lammel,2015,Diversity of transgenic mouse models for selective targeting of midbrain dopamine neurons.,Neuron,4.0
231,22525486,Moylan,2013,"The neuroprogressive nature of major depressive disorder: pathways to disease evolution and resistance, and therapeutic implications.",Molecular psychiatry,4.0
648,24995986,Rothwell,2014,Autism-associated neuroligin-3 mutations commonly impair striatal circuits to boost repetitive behaviors.,Cell,4.0
974,2085740,Kita,1991,Parvalbumin-immunoreactive neurons in the rat neostriatum: a light and electron microscopic study.,Brain research,4.0
222,23493706,Xu,2013,A neural circuit for memory specificity and generalization.,"Science (New York, N.Y.)",4.0
4535,21490964,Leknes,2011,Relief as a reward: hedonic and neural responses to safety from pain.,PloS one,4.0
54,22326834,Sutherland,2013,Resting state functional connectivity in addiction: Lessons learned and a road ahead.,NeuroImage,4.0
727,4080159,Phillipson,1986,The topographic order of inputs to nucleus accumbens in the rat.,Neuroscience,4.0
1021,16885520,Tindell,2006,Ventral pallidum firing codes hedonic reward: when a bad taste turns good.,Journal of neurophysiology,4.0
714,23143514,MacAskill,2013,Subcellular connectivity underlies pathway-specific signaling in the nucleus accumbens.,Nature neuroscience,4.0
621,24460492,Wilden,2014,Reduced ethanol consumption by alcohol-preferring (P) rats following pharmacological silencing and deep brain stimulation of the nucleus accumbens shell.,Journal of neurosurgery,4.0
1116,26373473,Parsons,2015,Endocannabinoid signalling in reward and addiction.,Nature reviews. Neuroscience,4.0
57,18242816,Picciotto,2008,"It is not ""either/or"": activation and desensitization of nicotinic acetylcholine receptors both contribute to behaviors related to nicotine addiction and mood.",Progress in neurobiology,4.0
705,27145911,Lüscher,2018,The Emergence of a Circuit Model for Addiction.,Annual review of neuroscience,4.0
55,20554984,Benowitz,2010,Nicotine addiction.,The New England journal of medicine,4.0
1019,18955088,Smith,2009,Ventral pallidum roles in reward and motivation.,Behavioural brain research,4.0
61,30773318,Trouche,2020,A Hippocampus-Accumbens Tripartite Neuronal Motif Guides Appetitive Memory in Space.,Cell,4.0
731,27373830,Mamaligas,2017,Spontaneous Synaptic Activation of Muscarinic Receptors by Striatal Cholinergic Neuron Firing.,Neuron,4.0
875,27710792,Straub,2017,Principles of Synaptic Organization of GABAergic Interneurons in the Striatum.,Neuron,4.0
359,20372879,Ebner,2010,Depressive-like effects of the kappa opioid receptor agonist salvinorin A are associated with decreased phasic dopamine release in the nucleus accumbens.,Psychopharmacology,4.0
636,29654259,Turner,2019,mGlu<sub>1</sub> and mGlu<sub>5</sub> modulate distinct excitatory inputs to the nucleus accumbens shell.,Neuropsychopharmacology : official publication of the American College of Neuropsychopharmacology,4.0
986,25349168,Schmidt,2016,ADAR2-dependent GluA2 editing regulates cocaine seeking.,Molecular psychiatry,4.0
3682,12084661,Andersen,2002,Pubertal changes in gonadal hormones do not underlie adolescent dopamine receptor overproduction.,Psychoneuroendocrinology,3.0
2250,2465635,Mansour,1989,Anatomy of CNS opioid receptors.,Trends in neurosciences,3.0
3643,22529814,Mathur,2012,Endocannabinoid-dopamine interactions in striatal synaptic plasticity.,Frontiers in pharmacology,3.0
4607,17210054,Bolte,2007,A guided tour into subcellular colocalization analysis in light microscopy.,Journal of microscopy,3.0
4608,16759333,Sanchis-Segura,2006,Behavioural assessment of drug reinforcement and addictive features in rodents: an overview.,Addiction biology,3.0
3629,11113625,Yim,2001,Ethanol-induced increases in dopamine extracellular concentration in rat nucleus accumbens are accounted for by increased release and not uptake inhibition.,"Alcohol (Fayetteville, N.Y.)",3.0
2203,10942857,Bell,2000,Context-specific enhancement of glutamate transmission by cocaine.,Neuropsychopharmacology : official publication of the American College of Neuropsychopharmacology,3.0
4577,9473676,Hildebrand,1998,Reduced dopamine output in the nucleus accumbens but not in the medial prefrontal cortex in rats displaying a mecamylamine-precipitated nicotine withdrawal syndrome.,Brain research,3.0
3686,6320006,Nowak,1984,Magnesium gates glutamate-activated channels in mouse central neurones.,Nature,3.0
3688,2299346,Ke,1990,Binding of progesterone to nerve cell membranes of rat brain using progesterone conjugated to 125I-bovine serum albumin as a ligand.,Journal of neurochemistry,3.0
2207,10675916,Calabresi,2000,Acetylcholine-mediated modulation of striatal function.,Trends in neurosciences,3.0
3679,19761818,Milad,2010,Estrous cycle phase and gonadal hormones influence conditioned fear extinction.,Neuroscience,3.0
2307,15901789,Boulware,2006,"Estradiol activates group I and II metabotropic glutamate receptor signaling, leading to opposing influences on cAMP response element-binding protein.",The Journal of neuroscience : the official journal of the Society for Neuroscience,3.0
2300,9276849,Koob,1997,The neurobiology of drug addiction.,The Journal of neuropsychiatry and clinical neurosciences,3.0
2285,18509037,Sekine,2008,Methamphetamine causes microglial activation in the brains of human abusers.,The Journal of neuroscience : the official journal of the Society for Neuroscience,3.0
2240,7870955,Roberts,1995,Heroin self-administration in rats under a progressive ratio schedule of reinforcement.,Psychopharmacology,3.0
4602,19046372,Chaudhri,2009,Reinstated ethanol-seeking in rats is modulated by environmental context and requires the nucleus accumbens core.,The European journal of neuroscience,3.0
4595,9527537,Koylu,1998,Cocaine- and amphetamine-regulated transcript peptide immunohistochemical localization in the rat brain.,The Journal of comparative neurology,3.0
3656,11996317,Grigson,2002,Cocaine-induced suppression of saccharin intake: a model of drug-induced devaluation of natural rewards.,Behavioral neuroscience,3.0
2267,24089398,Koranda,2014,Nicotinic receptors regulate the dynamic range of dopamine release in vivo.,Journal of neurophysiology,3.0
3655,14756584,Baker,2004,Addiction motivation reformulated: an affective processing model of negative reinforcement.,Psychological review,3.0
2242,7760933,Liao,1995,Activation of postsynaptically silent synapses during pairing-induced LTP in CA1 region of hippocampal slice.,Nature,3.0
4591,25984282,Radfar,2015,"Current research on methamphetamine: epidemiology, medical and psychiatric effects, treatment, and harm reduction efforts.",Addiction & health,3.0
4600,10195164,Hollerman,1999,Dopamine neurons report an error in the temporal prediction of reward during learning.,Nature neuroscience,3.0
3657,11057517,Sinha,2001,"Psychological stress, drug-related cues and cocaine craving.",Psychopharmacology,3.0
2276,12764127,Cragg,2003,Variable dopamine release probability and short-term plasticity between functional domains of the primate striatum.,The Journal of neuroscience : the official journal of the Society for Neuroscience,3.0
2251,1722890,McDonald,1992,"Topographical organization of amygdaloid projections to the caudatoputamen, nucleus accumbens, and related striatal-like areas of the rat brain.",Neuroscience,3.0
2278,8412305,Kawagoe,1993,Principles of voltammetry and microelectrode surface states.,Journal of neuroscience methods,3.0
3665,25032491,Buffington,2015,Translational control in synaptic plasticity and cognitive dysfunction.,Annual review of neuroscience,3.0
2281,27012890,Joffe,2017,GluN1 deletions in D1- and A2A-expressing cell types reveal distinct modes of behavioral regulation.,Neuropharmacology,3.0
4588,29861096,Walker,2019,Cocaine Self-administration Alters Transcriptome-wide Responses in the Brain's Reward Circuitry.,Biological psychiatry,3.0
2279,659674,Fallon,1978,Catecholamine innervation of the basal forebrain. IV. Topography of the dopamine projection to the basal forebrain and neostriatum.,The Journal of comparative neurology,3.0
2248,2501818,Roberts,1989,The estrous cycle affects cocaine self-administration on a progressive ratio schedule in rats.,Psychopharmacology,3.0
2238,7903183,Pennartz,1994,Synaptic plasticity in an in vitro slice preparation of the rat nucleus accumbens.,The European journal of neuroscience,3.0
3652,20451589,Park,2011,In vivo voltammetric monitoring of catecholamine release in subterritories of the nucleus accumbens shell.,Neuroscience,3.0
2229,8774428,Nicola,1997,Psychostimulants depress excitatory synaptic transmission in the nucleus accumbens via presynaptic D1-like dopamine receptors.,The Journal of neuroscience : the official journal of the Society for Neuroscience,3.0
3677,24381154,Cahill,2014,Fundamental sex difference in human brain architecture.,Proceedings of the National Academy of Sciences of the United States of America,3.0
2253,1534574,Pennartz,1992,Presynaptic dopamine D1 receptors attenuate excitatory and inhibitory limbic inputs to the shell region of the rat nucleus accumbens studied in vitro.,Journal of neurophysiology,3.0
3669,22072660,Liu-Yesucevitz,2012,Local RNA translation at the synapse and in disease.,The Journal of neuroscience : the official journal of the Society for Neuroscience,3.0
2249,2473414,Zahm,1989,The ventral striatopallidal parts of the basal ganglia in the rat--II. Compartmentation of ventral pallidal efferents.,Neuroscience,3.0
2223,9284354,Maurice,1997,Position of the ventral pallidum in the rat prefrontal cortex-basal ganglia circuit.,Neuroscience,3.0
1153,24035479,Saddoris,2014,Cocaine self-administration abolishes associative neural encoding in the nucleus accumbens necessary for higher-order learning.,Biological psychiatry,3.0
3626,16961759,Bell,2006,The alcohol-preferring P rat and animal models of excessive alcohol drinking.,Addiction biology,3.0
2445,18390562,Clark,2008,Differential effects of insular and ventromedial prefrontal cortex lesions on risky decision-making.,Brain : a journal of neurology,3.0
3557,19709647,Green,2010,Environmental enrichment produces a behavioral phenotype mediated by low cyclic adenosine monophosphate response element binding (CREB) activity in the nucleus accumbens.,Biological psychiatry,3.0
2451,20065959,Lenard,2010,Chronic suppression of μ-opioid receptor signaling in the nucleus accumbens attenuates development of diet-induced obesity in rats.,International journal of obesity (2005),3.0
352,21906660,Surmeier,2012,"Dopaminergic modulation of striatal neurons, circuits, and assemblies.",Neuroscience,3.0
356,21195719,McCool,2012,Ethanol modulation of synaptic plasticity.,Neuropharmacology,3.0
2448,22805601,Giuliano,2013,Inhibition of opioid transmission at the μ-opioid receptor prevents both food seeking and binge-like eating.,Neuropsychopharmacology : official publication of the American College of Neuropsychopharmacology,3.0
2446,16129404,Kuhnen,2005,The neural basis of financial risk taking.,Neuron,3.0
2443,22959813,Admon,2013,Functional and structural neural indices of risk aversion in obsessive-compulsive disorder (OCD).,Psychiatry research,3.0
2455,19282821,Davis,2009,"Dopamine for ""wanting"" and opioids for ""liking"": a comparison of obese adults with and without binge eating.","Obesity (Silver Spring, Md.)",3.0
3560,15939839,Kessler,2005,"Prevalence, severity, and comorbidity of 12-month DSM-IV disorders in the National Comorbidity Survey Replication.",Archives of general psychiatry,3.0
3563,16123768,Bäckström,2006,Ionotropic and metabotropic glutamate receptor antagonism attenuates cue-induced cocaine seeking.,Neuropsychopharmacology : official publication of the American College of Neuropsychopharmacology,3.0
3565,14511343,Ghasemzadeh,2003,Homer1 proteins and AMPA receptors modulate cocaine-induced behavioural plasticity.,The European journal of neuroscience,3.0
3566,9096158,Pierce,1997,Repeated cocaine modifies the mechanism by which amphetamine releases dopamine.,The Journal of neuroscience : the official journal of the Society for Neuroscience,3.0
2432,28993631,Takahashi,2019,Establishment of a repeated social defeat stress model in female mice.,Scientific reports,3.0
365,18511209,Howard,2008,The shell of the nucleus accumbens has a higher dopamine response compared with the core after non-contingent intravenous ethanol administration.,Neuroscience,3.0
2454,19336249,Taha,2009,"Convergent, not serial, striatal and pallidal circuits regulate opioid-induced food intake.",Neuroscience,3.0
3555,25221490,Zhang,2014,"Overexpression of DeltaFosB in nucleus accumbens mimics the protective addiction phenotype, but not the protective depression phenotype of environmental enrichment.",Frontiers in behavioral neuroscience,3.0
3574,11020229,Todtenkopf,2000,Assessment of tyrosine hydroxylase immunoreactive innervation in five subregions of the nucleus accumbens shell in rats treated with repeated cocaine.,"Synapse (New York, N.Y.)",3.0
2474,26019865,Nauczyciel,2015,The nucleus accumbens: a target for deep brain stimulation in resistant major depressive disorder.,Journal of molecular psychiatry,3.0
2494,9877018,Itzhak,1999,Resistance of neuronal nitric oxide synthase-deficient mice to cocaine-induced locomotor sensitization.,Psychopharmacology,3.0
2493,11268215,Bibb,2001,Effects of chronic exposure to cocaine are regulated by the neuronal protein Cdk5.,Nature,3.0
2486,19789384,Le Merrer,2009,Reward processing by the opioid system in the brain.,Physiological reviews,3.0
332,24737889,Danjo,2014,Aversive behavior induced by optogenetic inactivation of ventral tegmental area dopamine neurons is mediated by dopamine D2 receptors in the nucleus accumbens.,Proceedings of the National Academy of Sciences of the United States of America,3.0
337,24117706,Yorgason,2014,Frequency-dependent effects of ethanol on dopamine release in the nucleus accumbens.,"Alcoholism, clinical and experimental research",3.0
338,23914176,Koob,2013,Addiction is a Reward Deficit and Stress Surfeit Disorder.,Frontiers in psychiatry,3.0
339,23581570,Ferris,2013,Examining the complex regulation and drug-induced plasticity of dopamine release and uptake using voltammetry in brain slices.,ACS chemical neuroscience,3.0
351,21939738,Rice,2012,Dopamine release in the basal ganglia.,Neuroscience,3.0
2467,11733709,Colantuoni,2002,Excessive sugar intake alters binding to dopamine and mu-opioid receptors in the brain.,Neuroreport,3.0
348,22712055,Zhang,None,Regulation of striatal dopamine release by presynaptic auto- and heteroreceptors.,Basal ganglia,3.0
2463,14622160,Kelley,2004,Restricted daily consumption of a highly palatable food (chocolate Ensure(R)) alters striatal enkephalin gene expression.,The European journal of neuroscience,3.0
3551,8329970,Saunders,1993,Development of the Alcohol Use Disorders Identification Test (AUDIT): WHO Collaborative Project on Early Detection of Persons with Harmful Alcohol Consumption--II.,"Addiction (Abingdon, England)",3.0
4659,23164701,Narayanaswami,2014,"Diet-induced obesity: dopamine transporter function, impulsivity and motivation.",International journal of obesity (2005),3.0
3552,3739800,Sobell,1986,The reliability of a timeline method for assessing normal drinker college students' recent drinking history: utility for alcohol research.,Addictive behaviors,3.0
2425,12740116,Malinow,2003,AMPA receptor trafficking and long-term potentiation.,"Philosophical transactions of the Royal Society of London. Series B, Biological sciences",3.0
